INDICATOR_CODE,PROVIDER_CODE,PROVIDER_NAME,DENOMINATOR,Q1_NUMERATOR,Q2_NUMERATOR,Q3_NUMERATOR,Q4_NUMERATOR,Q5_NUMERATOR,NULL_NUMERATOR,Q1_RATE,Q2_RATE,Q3_RATE,Q4_RATE,Q5_RATE,NULL_RATE
I00742,ENG,"ENGLAND",9100672,2157067,1871973,1719545,1580747,1451626,319714,23.7023,20.5696,18.8947,17.3696,15.9508,3.5131
I00742,REM,"AINTREE UNIVERSITY HOSPITAL NHS FOUNDATION TRUST",59349,34607,7765,7406,5084,3279,1208,58.3110,13.0836,12.4787,8.5663,5.5249,2.0354
I00742,RCF,"AIREDALE NHS FOUNDATION TRUST",33032,7135,4225,6372,10004,4913,383,21.6003,12.7906,19.2904,30.2858,14.8735,1.1595
I00742,RTK,"ASHFORD AND ST PETER'S HOSPITALS NHS FOUNDATION TRUST",41434,454,4493,6941,9800,19288,458,1.0957,10.8438,16.7519,23.6521,46.5511,1.1054
I00742,RF4,"BARKING, HAVERING AND REDBRIDGE UNIVERSITY HOSPITALS NHS TRUST",86945,17195,25095,17382,14054,6168,7051,19.7769,28.8631,19.9919,16.1642,7.0941,8.1097
I00742,RFF,"BARNSLEY HOSPITAL NHS FOUNDATION TRUST",43776,15100,12915,8401,4591,2108,661,34.4938,29.5025,19.1909,10.4875,4.8154,1.5100
I00742,R1H,"BARTS HEALTH NHS TRUST",170791,92792,37132,17029,9702,6137,7999,54.3307,21.7412,9.9707,5.6806,3.5933,4.6835
I00742,RDD,"BASILDON AND THURROCK UNIVERSITY HOSPITALS NHS FOUNDATION TRUST",74799,13525,20489,15179,11327,13592,687,18.0818,27.3921,20.2931,15.1433,18.1714,0.9185
I00742,RC1,"BEDFORD HOSPITAL NHS TRUST",36234,3363,6488,6093,8675,11233,382,9.2813,17.9058,16.8157,23.9416,31.0013,1.0543
I00742,RXL,"BLACKPOOL TEACHING HOSPITALS NHS FOUNDATION TRUST",54353,17698,10793,9974,9026,6263,599,32.5612,19.8572,18.3504,16.6063,11.5228,1.1021
I00742,RMC,"BOLTON NHS FOUNDATION TRUST",60663,28760,12417,7264,6809,4479,934,47.4095,20.4688,11.9744,11.2243,7.3834,1.5397
I00742,RAE,"BRADFORD TEACHING HOSPITALS NHS FOUNDATION TRUST",97441,54865,19137,13164,5730,3225,1320,56.3059,19.6396,13.5097,5.8805,3.3097,1.3547
I00742,RXH,"BRIGHTON AND SUSSEX UNIVERSITY HOSPITALS NHS TRUST",63023,8350,13442,13967,11915,14003,1346,13.2491,21.3287,22.1618,18.9058,22.2189,2.1357
I00742,RXQ,"BUCKINGHAMSHIRE HEALTHCARE NHS TRUST",59507,331,10441,9526,9987,28393,829,0.5562,17.5458,16.0082,16.7829,47.7137,1.3931
I00742,RWY,"CALDERDALE AND HUDDERSFIELD NHS FOUNDATION TRUST",70527,19491,18285,11146,12945,7959,701,27.6362,25.9262,15.8039,18.3547,11.2850,0.9939
I00742,RGT,"CAMBRIDGE UNIVERSITY HOSPITALS NHS FOUNDATION TRUST",74259,2058,9421,12417,21616,26663,2084,2.7714,12.6867,16.7212,29.1089,35.9054,2.8064
I00742,RQM,"CHELSEA AND WESTMINSTER HOSPITAL NHS FOUNDATION TRUST",92508,10680,27590,20028,14681,6223,13306,11.5449,29.8244,21.6500,15.8700,6.7270,14.3836
I00742,RFS,"CHESTERFIELD ROYAL HOSPITAL NHS FOUNDATION TRUST",51050,11329,14783,8947,9508,6236,247,22.1920,28.9579,17.5260,18.6249,12.2155,0.4838
I00742,RLN,"CITY HOSPITALS SUNDERLAND NHS FOUNDATION TRUST",57421,24391,15654,7377,5962,2074,1963,42.4775,27.2618,12.8472,10.3830,3.6119,3.4186
I00742,RJR,"COUNTESS OF CHESTER HOSPITAL NHS FOUNDATION TRUST",47216,9607,5085,5009,7142,11118,9255,20.3469,10.7697,10.6087,15.1262,23.5471,19.6014
I00742,RXP,"COUNTY DURHAM AND DARLINGTON NHS FOUNDATION TRUST",81986,24922,24110,13064,9549,9460,881,30.3979,29.4075,15.9344,11.6471,11.5386,1.0746
I00742,RJ6,"CROYDON HEALTH SERVICES NHS TRUST",39522,8032,13640,9552,4808,2364,1126,20.3229,34.5124,24.1688,12.1654,5.9815,2.8490
I00742,RN7,"DARTFORD AND GRAVESHAM NHS TRUST",57754,7058,14611,11809,13247,10375,654,12.2208,25.2987,20.4471,22.9369,17.9641,1.1324
I00742,RP5,"DONCASTER AND BASSETLAW TEACHING HOSPITALS NHS FOUNDATION TRUST",72759,28409,17036,13701,11031,1997,585,39.0453,23.4143,18.8307,15.1610,2.7447,0.8040
I00742,RBD,"DORSET COUNTY HOSPITAL NHS FOUNDATION TRUST",29278,3303,5065,10898,7361,2169,482,11.2815,17.2997,37.2225,25.1417,7.4083,1.6463
I00742,RWH,"EAST AND NORTH HERTFORDSHIRE NHS TRUST",66169,1548,7944,15854,14297,21033,5493,2.3395,12.0056,23.9599,21.6068,31.7868,8.3015
I00742,RJN,"EAST CHESHIRE NHS TRUST",19216,1298,2716,3922,3606,7403,271,6.7548,14.1341,20.4101,18.7656,38.5252,1.4103
I00742,RVV,"EAST KENT HOSPITALS UNIVERSITY NHS FOUNDATION TRUST",107553,20278,23812,28182,26535,7578,1168,18.8540,22.1398,26.2029,24.6716,7.0458,1.0860
I00742,RXR,"EAST LANCASHIRE HOSPITALS NHS TRUST",80355,36600,17331,8772,11826,4734,1092,45.5479,21.5680,10.9166,14.7172,5.8914,1.3590
I00742,RDE,"EAST SUFFOLK AND NORTH ESSEX NHS FOUNDATION TRUST",107396,12301,19725,22924,28040,18665,5741,11.4539,18.3666,21.3453,26.1090,17.3796,5.3456
I00742,RXC,"EAST SUSSEX HEALTHCARE NHS TRUST",60281,12960,17195,14297,10850,4464,515,21.4993,28.5247,23.7173,17.9990,7.4053,0.8543
I00742,RVR,"EPSOM AND ST HELIER UNIVERSITY HOSPITALS NHS TRUST",62203,2346,11837,11644,13874,21202,1300,3.7715,19.0296,18.7194,22.3044,34.0852,2.0899
I00742,RDU,"FRIMLEY HEALTH NHS FOUNDATION TRUST",129461,5264,19029,25545,24526,53301,1796,4.0661,14.6986,19.7318,18.9447,41.1715,1.3873
I00742,RR7,"GATESHEAD HEALTH NHS FOUNDATION TRUST",33568,13369,9426,3614,5000,1828,331,39.8266,28.0803,10.7662,14.8951,5.4457,0.9861
I00742,RLT,"GEORGE ELIOT HOSPITAL NHS TRUST",22590,3976,6425,4908,4206,2850,225,17.6007,28.4418,21.7264,18.6189,12.6162,0.9960
I00742,RTE,"GLOUCESTERSHIRE HOSPITALS NHS FOUNDATION TRUST",92926,9600,11327,23676,22293,25228,802,10.3308,12.1893,25.4783,23.9901,27.1485,0.8631
I00742,RN3,"GREAT WESTERN HOSPITALS NHS FOUNDATION TRUST",63489,6999,6434,10041,16957,22119,939,11.0240,10.1340,15.8153,26.7086,34.8391,1.4790
I00742,RJ1,"GUY'S AND ST THOMAS' NHS FOUNDATION TRUST",92370,26308,33381,12456,8178,7004,5043,28.4811,36.1384,13.4849,8.8535,7.5825,5.4596
I00742,RN5,"HAMPSHIRE HOSPITALS NHS FOUNDATION TRUST",62978,518,8274,11480,12828,28978,900,0.8225,13.1379,18.2286,20.3690,46.0129,1.4291
I00742,RCD,"HARROGATE AND DISTRICT NHS FOUNDATION TRUST",26889,671,1535,5964,8552,9886,281,2.4954,5.7087,22.1801,31.8048,36.7660,1.0450
I00742,RQX,"HOMERTON UNIVERSITY HOSPITAL NHS FOUNDATION TRUST",44661,31864,8456,1228,687,304,2122,71.3464,18.9337,2.7496,1.5383,0.6807,4.7513
I00742,RWA,"HULL AND EAST YORKSHIRE HOSPITALS NHS TRUST",84344,29215,12981,14345,14386,12894,523,34.6379,15.3905,17.0077,17.0563,15.2874,0.6201
I00742,RYJ,"IMPERIAL COLLEGE HEALTHCARE NHS TRUST",107358,29186,33221,20729,12267,5840,6115,27.1857,30.9441,19.3083,11.4263,5.4397,5.6959
I00742,R1F,"ISLE OF WIGHT NHS TRUST",17302,1223,5881,6581,2634,674,309,7.0685,33.9903,38.0361,15.2237,3.8955,1.7859
I00742,RGP,"JAMES PAGET UNIVERSITY HOSPITALS NHS FOUNDATION TRUST",32121,7837,7596,8930,6109,1366,283,24.3984,23.6481,27.8011,19.0187,4.2527,0.8810
I00742,RNQ,"KETTERING GENERAL HOSPITAL NHS FOUNDATION TRUST",51499,8780,12404,9533,9218,10688,876,17.0489,24.0859,18.5110,17.8994,20.7538,1.7010
I00742,RJZ,"KING'S COLLEGE HOSPITAL NHS FOUNDATION TRUST",110135,23848,27198,13770,15105,15268,14946,21.6534,24.6951,12.5028,13.7150,13.8630,13.5706
I00742,RAX,"KINGSTON HOSPITAL NHS FOUNDATION TRUST",57718,1621,5826,9302,18085,20482,2402,2.8085,10.0939,16.1163,31.3334,35.4863,4.1616
I00742,RXN,"LANCASHIRE TEACHING HOSPITALS NHS FOUNDATION TRUST",78233,20101,13464,14124,15794,13141,1609,25.6938,17.2101,18.0538,20.1884,16.7973,2.0567
I00742,RR8,"LEEDS TEACHING HOSPITALS NHS TRUST",125844,46027,24337,17934,21647,14350,1549,36.5746,19.3390,14.2510,17.2015,11.4030,1.2309
I00742,RJ2,"LEWISHAM AND GREENWICH NHS TRUST",90390,32730,31392,13129,7256,4676,1207,36.2098,34.7295,14.5248,8.0274,5.1731,1.3353
I00742,R1K,"LONDON NORTH WEST UNIVERSITY HEALTHCARE NHS TRUST",101039,14932,33958,30285,13338,6864,1662,14.7785,33.6088,29.9736,13.2008,6.7934,1.6449
I00742,RC9,"LUTON AND DUNSTABLE UNIVERSITY HOSPITAL NHS FOUNDATION TRUST",78597,15135,19280,15399,12931,13689,2163,19.2565,24.5302,19.5924,16.4523,17.4167,2.7520
I00742,RWF,"MAIDSTONE AND TUNBRIDGE WELLS NHS TRUST",73219,3207,7299,15731,22319,24065,598,4.3800,9.9687,21.4849,30.4825,32.8672,0.8167
I00742,R0A,"MANCHESTER UNIVERSITY NHS FOUNDATION TRUST",177108,75857,31973,23592,20670,19142,5874,42.8309,18.0528,13.3207,11.6708,10.8081,3.3166
I00742,RPA,"MEDWAY NHS FOUNDATION TRUST",55446,10115,16457,9832,8507,7314,3221,18.2430,29.6811,17.7326,15.3429,13.1912,5.8093
I00742,RBT,"MID CHESHIRE HOSPITALS NHS FOUNDATION TRUST",50090,7774,9024,8113,8383,13445,3351,15.5201,18.0156,16.1968,16.7359,26.8417,6.6900
I00742,RQ8,"MID ESSEX HOSPITAL SERVICES NHS TRUST",56313,2133,7521,11277,16699,16923,1760,3.7878,13.3557,20.0256,29.6539,30.0517,3.1254
I00742,RXF,"MID YORKSHIRE HOSPITALS NHS TRUST",94112,29496,24470,14768,12842,4762,7774,31.3414,26.0009,15.6919,13.6454,5.0599,8.2604
I00742,RD8,"MILTON KEYNES UNIVERSITY HOSPITAL NHS FOUNDATION TRUST",43279,5511,5439,5113,9555,14517,3144,12.7337,12.5673,11.8140,22.0777,33.5428,7.2645
I00742,RM1,"NORFOLK AND NORWICH UNIVERSITY HOSPITALS NHS FOUNDATION TRUST",90070,7516,14617,23748,23493,13981,6715,8.3446,16.2285,26.3662,26.0830,15.5224,7.4553
I00742,RVJ,"NORTH BRISTOL NHS TRUST",86321,10678,17790,15959,16401,24507,986,12.3701,20.6091,18.4880,19.0000,28.3905,1.1422
I00742,RNL,"NORTH CUMBRIA UNIVERSITY HOSPITALS NHS TRUST",46858,9182,10868,11087,8296,4213,3212,19.5954,23.1935,23.6608,17.7046,8.9910,6.8548
I00742,RAP,"NORTH MIDDLESEX UNIVERSITY HOSPITAL NHS TRUST",47566,22759,13065,5104,2915,1222,2501,47.8472,27.4671,10.7304,6.1283,2.5691,5.2580
I00742,RVW,"NORTH TEES AND HARTLEPOOL NHS FOUNDATION TRUST",59709,25804,11512,8668,5771,7596,358,43.2163,19.2802,14.5171,9.6652,12.7217,0.5996
I00742,RGN,"NORTH WEST ANGLIA NHS FOUNDATION TRUST",79680,9952,10806,16705,17638,17504,7075,12.4900,13.5617,20.9651,22.1360,21.9679,8.8793
I00742,RNS,"NORTHAMPTON GENERAL HOSPITAL NHS TRUST",69955,12366,13329,12085,12633,18601,941,17.6771,19.0537,17.2754,18.0588,26.5900,1.3452
I00742,RBZ,"NORTHERN DEVON HEALTHCARE NHS TRUST",31356,2697,9214,12022,6730,445,248,8.6012,29.3851,38.3403,21.4632,1.4192,0.7909
I00742,RJL,"NORTHERN LINCOLNSHIRE AND GOOLE NHS FOUNDATION TRUST",57815,17434,11306,12066,11448,5289,272,30.1548,19.5555,20.8700,19.8011,9.1481,0.4705
I00742,RTF,"NORTHUMBRIA HEALTHCARE NHS FOUNDATION TRUST",71850,17288,17601,13622,11939,10691,709,24.0612,24.4969,18.9589,16.6166,14.8796,0.9868
I00742,RX1,"NOTTINGHAM UNIVERSITY HOSPITALS NHS TRUST",136324,37417,27278,23248,22178,24137,2066,27.4471,20.0097,17.0535,16.2686,17.7056,1.5155
I00742,RTH,"OXFORD UNIVERSITY HOSPITALS NHS FOUNDATION TRUST",115000,7938,12216,20734,26221,44217,3674,6.9026,10.6226,18.0296,22.8009,38.4496,3.1948
I00742,RW6,"PENNINE ACUTE HOSPITALS NHS TRUST",127505,59100,23768,15176,11593,5808,12060,46.3511,18.6408,11.9023,9.0922,4.5551,9.4585
I00742,RD3,"POOLE HOSPITAL NHS FOUNDATION TRUST",50821,4226,10483,13823,11018,10368,903,8.3155,20.6273,27.1994,21.6800,20.4010,1.7768
I00742,RHU,"PORTSMOUTH HOSPITALS NHS TRUST",80397,14444,14871,14895,16849,17353,1985,17.9658,18.4970,18.5268,20.9572,21.5841,2.4690
I00742,RHW,"ROYAL BERKSHIRE NHS FOUNDATION TRUST",67404,3591,10283,10192,10951,25549,6838,5.3276,15.2558,15.1208,16.2468,37.9043,10.1448
I00742,REF,"ROYAL CORNWALL HOSPITALS NHS TRUST",71270,10465,27492,24017,6445,1274,1577,14.6836,38.5744,33.6986,9.0431,1.7876,2.2127
I00742,RH8,"ROYAL DEVON AND EXETER NHS FOUNDATION TRUST",62320,4178,12558,20444,18251,6409,480,6.7041,20.1508,32.8049,29.2859,10.2840,0.7702
I00742,RAL,"ROYAL FREE LONDON NHS FOUNDATION TRUST",103291,13125,23205,29311,23791,11138,2721,12.7068,22.4657,28.3771,23.0330,10.7831,2.6343
I00742,RQ6,"ROYAL LIVERPOOL AND BROADGREEN UNIVERSITY HOSPITALS NHS TRUST",50051,30187,7364,5181,3938,1388,1993,60.3125,14.7130,10.3514,7.8680,2.7732,3.9819
I00742,RA2,"ROYAL SURREY COUNTY HOSPITAL NHS FOUNDATION TRUST",48275,275,2902,6417,12797,25224,660,0.5697,6.0114,13.2926,26.5085,52.2506,1.3672
I00742,RD1,"ROYAL UNITED HOSPITALS BATH NHS FOUNDATION TRUST",59158,2408,7475,13222,16209,19248,596,4.0705,12.6357,22.3503,27.3995,32.5366,1.0075
I00742,RM3,"SALFORD ROYAL NHS FOUNDATION TRUST",49922,21352,11351,7649,4999,3449,1122,42.7707,22.7375,15.3219,10.0136,6.9088,2.2475
I00742,RNZ,"SALISBURY NHS FOUNDATION TRUST",37103,1471,2463,11145,11276,10452,296,3.9646,6.6383,30.0380,30.3911,28.1702,0.7978
I00742,RXK,"SANDWELL AND WEST BIRMINGHAM HOSPITALS NHS TRUST",69593,44407,13269,7281,1821,641,2174,63.8096,19.0666,10.4623,2.6166,0.9211,3.1239
I00742,RHQ,"SHEFFIELD TEACHING HOSPITALS NHS FOUNDATION TRUST",114630,43661,20656,19655,15790,12545,2323,38.0886,18.0197,17.1465,13.7748,10.9439,2.0265
I00742,RK5,"SHERWOOD FOREST HOSPITALS NHS FOUNDATION TRUST",54390,17316,16120,10197,6949,3524,284,31.8367,29.6378,18.7479,12.7762,6.4791,0.5222
I00742,RXW,"SHREWSBURY AND TELFORD HOSPITAL NHS TRUST",68760,8301,14702,17900,12677,8052,7128,12.0724,21.3816,26.0326,18.4366,11.7103,10.3665
I00742,RTR,"SOUTH TEES HOSPITALS NHS FOUNDATION TRUST",87028,32090,13629,11640,16745,12129,795,36.8732,15.6605,13.3750,19.2409,13.9369,0.9135
I00742,RE9,"SOUTH TYNESIDE NHS FOUNDATION TRUST",22401,10683,5023,3558,1410,1533,194,47.6898,22.4231,15.8832,6.2944,6.8434,0.8660
I00742,RJC,"SOUTH WARWICKSHIRE NHS FOUNDATION TRUST",35662,561,3262,6478,10859,14010,492,1.5731,9.1470,18.1650,30.4498,39.2855,1.3796
I00742,RAJ,"SOUTHEND UNIVERSITY HOSPITAL NHS FOUNDATION TRUST",57062,9573,10601,11811,11016,13023,1038,16.7765,18.5780,20.6985,19.3053,22.8225,1.8191
I00742,RVY,"SOUTHPORT AND ORMSKIRK HOSPITAL NHS TRUST",32414,5453,6492,7399,7604,4505,961,16.8230,20.0284,22.8266,23.4590,13.8983,2.9648
I00742,RJ7,"ST GEORGE'S UNIVERSITY HOSPITALS NHS FOUNDATION TRUST",89034,8111,27050,22638,13655,14072,3508,9.1100,30.3817,25.4262,15.3368,15.8052,3.9401
I00742,RBN,"ST HELENS AND KNOWSLEY TEACHING HOSPITALS NHS TRUST",78701,39291,13390,11348,7705,5856,1111,49.9244,17.0138,14.4191,9.7902,7.4408,1.4117
I00742,RWJ,"STOCKPORT NHS FOUNDATION TRUST",57722,10195,11261,10562,10018,11678,4008,17.6622,19.5090,18.2980,17.3556,20.2315,6.9436
I00742,RTP,"SURREY AND SUSSEX HEALTHCARE NHS TRUST",53206,689,4878,12247,12114,16712,6566,1.2950,9.1681,23.0181,22.7681,31.4100,12.3407
I00742,RMP,"TAMESIDE AND GLOSSOP INTEGRATED CARE NHS FOUNDATION TRUST",34407,14299,9399,5248,3601,1644,216,41.5584,27.3171,15.2527,10.4659,4.7781,0.6278
I00742,RBA,"TAUNTON AND SOMERSET NHS FOUNDATION TRUST",58724,3799,14775,19423,12330,7803,594,6.4692,25.1601,33.0751,20.9965,13.2876,1.0115
I00742,RNA,"THE DUDLEY GROUP NHS FOUNDATION TRUST",61076,21355,14534,8212,8947,7262,766,34.9646,23.7966,13.4455,14.6490,11.8901,1.2542
I00742,RAS,"THE HILLINGDON HOSPITALS NHS FOUNDATION TRUST",40318,4573,16295,9560,4860,3770,1260,11.3423,40.4162,23.7115,12.0542,9.3507,3.1252
I00742,RTD,"THE NEWCASTLE UPON TYNE HOSPITALS NHS FOUNDATION TRUST",100857,35427,21633,13771,14353,12116,3557,35.1260,21.4492,13.6540,14.2310,12.0130,3.5268
I00742,RQW,"THE PRINCESS ALEXANDRA HOSPITAL NHS TRUST",49683,1729,13699,8549,10106,10911,4689,3.4801,27.5728,17.2071,20.3410,21.9612,9.4378
I00742,RCX,"THE QUEEN ELIZABETH HOSPITAL, KING'S LYNN, NHS FOUNDATION TRUST",47645,7343,15541,15979,6528,1850,404,15.4119,32.6183,33.5376,13.7013,3.8829,0.8479
I00742,RFR,"THE ROTHERHAM NHS FOUNDATION TRUST",37217,14801,9400,5655,4858,1508,995,39.7695,25.2573,15.1947,13.0532,4.0519,2.6735
I00742,RDZ,"THE ROYAL BOURNEMOUTH AND CHRISTCHURCH HOSPITALS NHS FOUNDATION TRUST",48959,4893,9881,10967,9750,12396,1072,9.9941,20.1822,22.4004,19.9146,25.3191,2.1896
I00742,RL4,"THE ROYAL WOLVERHAMPTON NHS TRUST",67694,26326,12584,9065,8473,4868,6378,38.8897,18.5895,13.3911,12.5166,7.1912,9.4218
I00742,RA9,"TORBAY AND SOUTH DEVON NHS FOUNDATION TRUST",46621,6710,13503,14082,8843,2614,869,14.3927,28.9633,30.2053,18.9678,5.6069,1.8640
I00742,RWD,"UNITED LINCOLNSHIRE HOSPITALS NHS TRUST",80117,14057,18427,18721,17164,10508,1240,17.5456,23.0001,23.3671,21.4237,13.1158,1.5477
I00742,RRV,"UNIVERSITY COLLEGE LONDON HOSPITALS NHS FOUNDATION TRUST",69959,18627,18470,10096,7214,5505,10047,26.6256,26.4012,14.4313,10.3118,7.8689,14.3613
I00742,RHM,"UNIVERSITY HOSPITAL SOUTHAMPTON NHS FOUNDATION TRUST",94562,13386,16596,20752,18091,22587,3150,14.1558,17.5504,21.9454,19.1314,23.8859,3.3311
I00742,RRK,"UNIVERSITY HOSPITALS BIRMINGHAM NHS FOUNDATION TRUST",270010,115633,41965,41620,31313,28962,10517,42.8255,15.5420,15.4142,11.5970,10.7263,3.8950
I00742,RA7,"UNIVERSITY HOSPITALS BRISTOL NHS FOUNDATION TRUST",79838,17282,15551,14008,15372,13395,4230,21.6463,19.4782,17.5455,19.2540,16.7777,5.2982
I00742,RKB,"UNIVERSITY HOSPITALS COVENTRY AND WARWICKSHIRE NHS TRUST",97620,25052,21894,19616,16453,13158,1447,25.6628,22.4278,20.0942,16.8541,13.4788,1.4823
I00742,RTG,"UNIVERSITY HOSPITALS OF DERBY AND BURTON NHS FOUNDATION TRUST",129841,23812,24330,28932,25843,23989,2935,18.3394,18.7383,22.2826,19.9036,18.4757,2.2605
I00742,RWE,"UNIVERSITY HOSPITALS OF LEICESTER NHS TRUST",156556,28615,30235,23216,29831,35341,9318,18.2778,19.3126,14.8292,19.0545,22.5740,5.9519
I00742,RTX,"UNIVERSITY HOSPITALS OF MORECAMBE BAY NHS FOUNDATION TRUST",50736,10489,8790,12013,12722,6151,571,20.6737,17.3250,23.6775,25.0749,12.1235,1.1254
I00742,RJE,"UNIVERSITY HOSPITALS OF NORTH MIDLANDS NHS TRUST",134636,42240,26802,24515,24591,14713,1775,31.3735,19.9070,18.2084,18.2648,10.9280,1.3184
I00742,RK9,"UNIVERSITY HOSPITALS PLYMOUTH NHS TRUST",71417,13518,18830,17732,14704,5190,1443,18.9283,26.3663,24.8288,20.5889,7.2672,2.0205
I00742,RBK,"WALSALL HEALTHCARE NHS TRUST",44499,22966,9855,4991,3424,2571,692,51.6101,22.1466,11.2160,7.6946,5.7777,1.5551
I00742,RWW,"WARRINGTON AND HALTON HOSPITALS NHS FOUNDATION TRUST",44928,14240,8108,5036,8677,8526,341,31.6952,18.0467,11.2090,19.3131,18.9770,0.7590
I00742,RWG,"WEST HERTFORDSHIRE HOSPITALS NHS TRUST",60766,549,8217,13537,11777,21463,5223,0.9035,13.5224,22.2773,19.3809,35.3207,8.5953
I00742,RGR,"WEST SUFFOLK NHS FOUNDATION TRUST",36496,365,4767,9286,14553,6915,610,1.0001,13.0617,25.4439,39.8756,18.9473,1.6714
I00742,RYR,"WESTERN SUSSEX HOSPITALS NHS FOUNDATION TRUST",77451,5995,13808,25712,18328,12428,1180,7.7404,17.8280,33.1978,23.6640,16.0463,1.5235
I00742,RA3,"WESTON AREA HEALTH NHS TRUST",16643,2962,2625,3279,5090,2143,544,17.7973,15.7724,19.7020,30.5834,12.8763,3.2686
I00742,RKE,"WHITTINGTON HEALTH NHS TRUST",25873,11050,8230,3300,1565,425,1303,42.7086,31.8092,12.7546,6.0488,1.6426,5.0361
I00742,RBL,"WIRRAL UNIVERSITY TEACHING HOSPITAL NHS FOUNDATION TRUST",68066,24519,11713,9214,9380,10890,2350,36.0224,17.2083,13.5369,13.7807,15.9992,3.4525
I00742,RWP,"WORCESTERSHIRE ACUTE HOSPITALS NHS TRUST",71515,9541,10557,17759,19634,13052,972,13.3413,14.7619,24.8326,27.4544,18.2507,1.3592
I00742,RRF,"WRIGHTINGTON, WIGAN AND LEIGH NHS FOUNDATION TRUST",47871,16272,11129,6702,7632,5248,888,33.9914,23.2479,14.0001,15.9428,10.9628,1.8550
I00742,RLQ,"WYE VALLEY NHS TRUST",28696,1983,3510,12569,6045,1179,3410,6.9104,12.2317,43.8005,21.0657,4.1086,11.8832
I00742,RA4,"YEOVIL DISTRICT HOSPITAL NHS FOUNDATION TRUST",28707,1293,3252,8457,11663,3862,180,4.5041,11.3282,29.4597,40.6277,13.4532,0.6270
I00742,RCB,"YORK TEACHING HOSPITAL NHS FOUNDATION TRUST",88165,11099,14238,19097,20335,21944,1452,12.5889,16.1493,21.6605,23.0647,24.8897,1.6469
