INDICATOR_CODE,PROVIDER,PROVIDER_NAME,DENOMINATOR,Q_1_NUMERATOR,Q_2_NUMERATOR,Q_3_NUMERATOR,Q_4_NUMERATOR,Q_5_NUMERATOR,NULL_NUMERATOR,Q_1_RATE,Q_2_RATE,Q_3_RATE,Q_4_RATE,Q_5_RATE,NULL_RATE
I00742,R1F,ISLE OF WIGHT NHS TRUST,19096,1244,5988,6895,2748,755,1466,6.514453289,31.35735233,36.10703812,14.39044826,3.953707583,7.677000419
I00742,R1H,BARTS HEALTH NHS TRUST,162580,82924,31617,13759,8598,5293,20389,51.00504367,19.44704146,8.462910567,5.288473367,3.255627999,12.54090294
I00742,RA2,ROYAL SURREY COUNTY HOSPITAL NHS FOUNDATION TRUST,45565,225,2522,5876,10225,23089,3628,0.493800066,5.534950071,12.89586305,22.44046966,50.67266542,7.962251728
I00742,RA3,WESTON AREA HEALTH NHS TRUST,16827,3037,2522,3415,5198,2260,395,18.04837464,14.9878172,20.29476437,30.89083021,13.43079574,2.34741784
I00742,RA4,YEOVIL DISTRICT HOSPITAL NHS FOUNDATION TRUST,24321,928,2453,6869,9241,3039,1791,3.815632581,10.08593397,28.24308211,37.99597056,12.49537437,7.364006414
I00742,RA7,UNIVERSITY HOSPITALS BRISTOL NHS FOUNDATION TRUST,65116,15016,12807,11047,12373,11141,2732,23.06038454,19.66797715,16.96510842,19.00147429,17.10946618,4.19558941
I00742,RA9,SOUTH DEVON HEALTHCARE NHS FOUNDATION TRUST,39067,5226,10709,11168,7202,2103,2659,13.37701897,27.41188215,28.5867868,18.43499629,5.383059872,6.806255919
I00742,RAE,BRADFORD TEACHING HOSPITALS NHS FOUNDATION TRUST,74451,37668,13572,9662,4760,2766,6023,50.59435065,18.2294395,12.97766316,6.393466844,3.715195229,8.089884622
I00742,RAJ,SOUTHEND UNIVERSITY HOSPITAL NHS FOUNDATION TRUST,49302,7410,8734,9436,8889,10726,4107,15.02981623,17.71530567,19.13918299,18.02969454,21.75570971,8.33029086
I00742,RAL,ROYAL FREE LONDON NHS FOUNDATION TRUST,39884,7160,9722,8809,7101,2792,4300,17.95206098,24.3756895,22.086551,17.80413198,7.000300873,10.78126567
I00742,RAP,NORTH MIDDLESEX UNIVERSITY HOSPITAL NHS TRUST,29622,15584,6947,1988,760,333,4010,52.60954696,23.45216393,6.711228141,2.565660658,1.124164472,13.53723584
I00742,RAS,THE HILLINGDON HOSPITALS NHS FOUNDATION TRUST,38871,3338,13760,8478,4734,3664,4897,8.587378766,35.39914075,21.81060431,12.17874508,9.426050269,12.59808083
I00742,RAX,KINGSTON HOSPITAL NHS FOUNDATION TRUST,46930,1221,4019,6958,13088,14911,6733,2.601747283,8.563818453,14.8263371,27.88834434,31.77285319,14.34689964
I00742,RBA,TAUNTON AND SOMERSET NHS FOUNDATION TRUST,51894,3364,12415,16305,9999,6241,3570,6.482444984,23.92376768,31.41981732,19.26812348,12.02643851,6.879408024
I00742,RBD,DORSET COUNTY HOSPITAL NHS FOUNDATION TRUST,29142,3167,4677,9949,7039,2209,2101,10.86747649,16.04900144,34.1397296,24.15414179,7.580124906,7.20952577
I00742,RBK,WALSALL HEALTHCARE NHS TRUST,42306,18912,8480,4532,3186,2236,4960,44.70287902,20.04443814,10.7124285,7.530846688,5.285302321,11.72410533
I00742,RBL,WIRRAL UNIVERSITY TEACHING HOSPITAL NHS FOUNDATION TRUST,63749,21849,10714,8342,8443,9879,4522,34.2734788,16.80653814,13.08569546,13.24412932,15.49671367,7.093444603
I00742,RBN,ST HELENS AND KNOWSLEY HOSPITALS NHS TRUST,68011,32153,11244,9497,6021,4350,4746,47.27617591,16.53261972,13.9639176,8.852979665,6.396024173,6.978282925
I00742,RBT,MID CHESHIRE HOSPITALS NHS FOUNDATION TRUST,37012,6406,7519,6335,6267,9990,495,17.30790014,20.31503296,17.11607046,16.93234627,26.99124608,1.337404085
I00742,RBZ,NORTHERN DEVON HEALTHCARE NHS TRUST,29870,2352,8241,10589,6100,875,1713,7.874121192,27.58955474,35.45028457,20.42182792,2.929360562,5.734851021
I00742,RC1,BEDFORD HOSPITAL NHS TRUST,28939,2643,5270,4851,6613,9350,212,9.133003905,18.2107191,16.76284599,22.85151526,32.30934034,0.732575417
I00742,RC3,EALING HOSPITAL NHS TRUST,29238,7190,10358,6991,1490,454,2755,24.59128531,35.42649976,23.9106642,5.096107805,1.552773788,9.422669129
I00742,RC9,LUTON AND DUNSTABLE UNIVERSITY HOSPITAL NHS FOUNDATION TRUST,60402,10944,14490,10942,8735,9101,6190,18.11860534,23.98927188,18.1152942,14.46144167,15.06738187,10.24800503
I00742,RCB,YORK TEACHING HOSPITAL NHS FOUNDATION TRUST,76092,9063,11711,15249,16570,17927,5572,11.91058193,15.39057982,20.04021448,21.77627083,23.55963833,7.322714609
I00742,RCD,HARROGATE AND DISTRICT NHS FOUNDATION TRUST,23633,678,1344,4463,7065,8070,2013,2.868869801,5.686963145,18.8846105,29.89463885,34.1471671,8.517750603
I00742,RCF,AIREDALE NHS FOUNDATION TRUST,30386,6441,3883,5668,8098,4298,1998,21.1972619,12.77891134,18.65332719,26.65043112,14.14467189,6.575396564
I00742,RCX,"THE QUEEN ELIZABETH HOSPITAL, KING'S LYNN, NHS FOUNDATION TRUST",37547,5268,11317,12120,4781,1461,2600,14.03041521,30.14089008,32.27954297,12.73337417,3.891123126,6.924654433
I00742,RD1,ROYAL UNITED HOSPITAL BATH NHS TRUST,41572,1795,5448,9553,11093,13307,376,4.317810064,13.1049745,22.97940922,26.68382565,32.00952564,0.904454922
I00742,RD3,POOLE HOSPITAL NHS FOUNDATION TRUST,51095,4235,10719,12999,10379,9248,3515,8.288482239,20.97856933,25.44084548,20.31314219,18.09961836,6.879342401
I00742,RD7,HEATHERWOOD AND WEXHAM PARK HOSPITALS NHS FOUNDATION TRUST,51330,3253,12276,13111,9258,12998,434,6.337424508,23.91583869,25.5425677,18.03623612,25.32242353,0.845509449
I00742,RD8,MILTON KEYNES HOSPITAL NHS FOUNDATION TRUST,41056,5093,5295,4810,8671,12822,4365,12.40500779,12.89701871,11.71570538,21.11993375,31.23051442,10.63181995
I00742,RDD,BASILDON AND THURROCK UNIVERSITY HOSPITALS NHS FOUNDATION TRUST,50461,8901,13069,9475,7516,9374,2126,17.63936505,25.89920929,18.77687719,14.89467113,18.57672262,4.213154714
I00742,RDE,COLCHESTER HOSPITAL UNIVERSITY NHS FOUNDATION TRUST,51348,5263,11128,11959,12028,6745,4225,10.24966893,21.67173016,23.29009893,23.42447612,13.13585729,8.228168575
I00742,RDU,FRIMLEY PARK HOSPITAL NHS FOUNDATION TRUST,54239,770,2995,7159,9888,27720,5707,1.419642693,5.521856966,13.19898966,18.2304246,51.10713693,10.52194915
I00742,RDZ,THE ROYAL BOURNEMOUTH AND CHRISTCHURCH HOSPITALS NHS FOUNDATION TRUST,46750,4466,9487,10735,9494,11477,1091,9.552941176,20.29304813,22.96256684,20.30802139,24.54973262,2.33368984
I00742,RE9,SOUTH TYNESIDE NHS FOUNDATION TRUST,23192,10226,5108,3529,1364,1470,1495,44.09279062,22.02483615,15.21645395,5.881338393,6.338392549,6.446188341
I00742,REF,ROYAL CORNWALL HOSPITALS NHS TRUST,66903,9651,24093,21372,5363,1169,5255,14.42536209,36.01183803,31.94475584,8.016082986,1.747305801,7.854655247
I00742,REM,AINTREE UNIVERSITY HOSPITAL NHS FOUNDATION TRUST,41192,23467,5810,5014,4062,2232,607,56.96979996,14.10468052,12.17226646,9.861138085,5.418527869,1.473587104
I00742,RF4,"BARKING, HAVERING AND REDBRIDGE UNIVERSITY HOSPITALS NHS TRUST",80546,16447,22780,16318,11016,4837,9148,20.41938768,28.28197552,20.25923075,13.67665682,6.005264073,11.35748516
I00742,RFF,BARNSLEY HOSPITAL NHS FOUNDATION TRUST,42454,14552,11801,7332,3989,1829,2951,34.27709992,27.79714515,17.27045744,9.396052198,4.308192396,6.951052904
I00742,RFR,THE ROTHERHAM NHS FOUNDATION TRUST,40763,16890,10714,5845,5425,1527,362,41.43463435,26.28363958,14.33898388,13.30863774,3.746044207,0.888060251
I00742,RFS,CHESTERFIELD ROYAL HOSPITAL NHS FOUNDATION TRUST,34742,7613,9490,5772,5890,3818,2159,21.91295838,27.31564101,16.61389672,16.95354326,10.98958034,6.214380289
I00742,RFW,WEST MIDDLESEX UNIVERSITY HOSPITAL NHS TRUST,35003,2765,10508,7656,5343,3088,5643,7.899322915,30.02028398,21.87241094,15.26440591,8.822100963,16.1214753
I00742,RGN,PETERBOROUGH AND STAMFORD HOSPITALS NHS FOUNDATION TRUST,50940,9770,7383,8839,12022,7852,5074,19.17942678,14.49352179,17.35178642,23.6003141,15.4142128,9.960738123
I00742,RGP,JAMES PAGET UNIVERSITY HOSPITALS NHS FOUNDATION TRUST,33688,7872,7564,8765,5906,1206,2375,23.36737117,22.45309903,26.01816671,17.53146521,3.57990976,7.049988126
I00742,RGQ,IPSWICH HOSPITAL NHS TRUST,47445,6074,5957,8547,12852,9971,4044,12.80219201,12.55559068,18.01454316,27.0882074,21.01591316,8.523553588
I00742,RGR,WEST SUFFOLK NHS FOUNDATION TRUST,32718,413,3975,7739,11996,5806,2789,1.262302097,12.14927563,23.65364631,36.66483281,17.74558347,8.52435968
I00742,RGT,CAMBRIDGE UNIVERSITY HOSPITALS NHS FOUNDATION TRUST,71017,1834,8627,11524,18855,23778,6399,2.582480251,12.1477956,16.22710055,26.54998099,33.482124,9.010518608
I00742,RH8,ROYAL DEVON AND EXETER NHS FOUNDATION TRUST,59392,4072,11429,18073,15576,5793,4449,6.856142241,19.24333244,30.43002425,26.22575431,9.753838901,7.490907866
I00742,RHM,UNIVERSITY HOSPITAL SOUTHAMPTON NHS FOUNDATION TRUST,90207,11811,14780,18685,16756,20797,7378,13.09321893,16.38453779,20.71347013,18.57505515,23.05475185,8.178966156
I00742,RHQ,SHEFFIELD TEACHING HOSPITALS NHS FOUNDATION TRUST,107529,38254,18561,17389,14215,10983,8127,35.57551916,17.26138995,16.17145142,13.21968957,10.21398878,7.557961108
I00742,RHU,PORTSMOUTH HOSPITALS NHS TRUST,86081,15379,15148,14665,16973,16749,7167,17.86573111,17.59737921,17.03627978,19.7174754,19.45725538,8.325879114
I00742,RHW,ROYAL BERKSHIRE NHS FOUNDATION TRUST,62694,3209,9198,9928,10164,23998,6197,5.118512138,14.67126041,15.83564615,16.21207771,38.27798513,9.884518455
I00742,RJ1,GUY'S AND ST THOMAS' NHS FOUNDATION TRUST,84473,22393,29564,9992,6982,5518,10024,26.50906207,34.99816509,11.82863163,8.265362897,6.532264747,11.86651356
I00742,RJ2,LEWISHAM AND GREENWICH NHS TRUST,82163,28674,28717,10439,5280,3177,5876,34.89892044,34.95125543,12.70523228,6.426250259,3.866703991,7.151637598
I00742,RJ6,CROYDON HEALTH SERVICES NHS TRUST,44812,8700,15204,9882,4723,2402,3901,19.41444256,33.92841203,22.05212889,10.53958761,5.360171383,8.70525752
I00742,RJ7,ST GEORGE'S HEALTHCARE NHS TRUST,80233,7510,22867,19469,11700,12362,6325,9.360238306,28.50074159,24.26557651,14.58252839,15.40762529,7.883289918
I00742,RJC,SOUTH WARWICKSHIRE NHS FOUNDATION TRUST,33894,456,3184,5678,9115,12345,3116,1.345370862,9.393993037,16.75222753,26.89266537,36.42237564,9.193367558
I00742,RJD,MID STAFFORDSHIRE NHS FOUNDATION TRUST,30372,3104,6546,5914,7215,5521,2072,10.21993942,21.55274595,19.471882,23.75543264,18.17792704,6.822072962
I00742,RJE,UNIVERSITY HOSPITAL OF NORTH STAFFORDSHIRE NHS TRUST,100351,33774,19266,17125,15738,8002,6446,33.6558679,19.19861287,17.06510149,15.68295284,7.974011221,6.423453678
I00742,RJF,BURTON HOSPITALS NHS FOUNDATION TRUST,41074,5540,7178,9138,9511,6107,3600,13.4878512,17.47577543,22.24765058,23.15576764,14.86828651,8.764668647
I00742,RJL,NORTHERN LINCOLNSHIRE AND GOOLE NHS FOUNDATION TRUST,57605,15910,10045,11029,10306,4706,5609,27.61913028,17.43772242,19.14590747,17.89080809,8.169429737,9.737001996
I00742,RJN,EAST CHESHIRE NHS TRUST,23774,1487,3188,4433,4151,8480,2035,6.25473206,13.40960713,18.64642046,17.46025069,35.66921847,8.559771179
I00742,RJR,COUNTESS OF CHESTER HOSPITAL NHS FOUNDATION TRUST,47087,9168,4809,4614,6809,9731,11956,19.47034213,10.21300996,9.798882919,14.4604668,20.66600123,25.39129696
I00742,RJZ,KING'S COLLEGE HOSPITAL NHS FOUNDATION TRUST,113656,26647,29767,14821,14560,14512,13349,23.44530865,26.19043429,13.04022665,12.81058633,12.76835363,11.74509045
I00742,RK5,SHERWOOD FOREST HOSPITALS NHS FOUNDATION TRUST,50932,15439,14216,8661,5947,2951,3718,30.31296631,27.91172544,17.00502631,11.67635278,5.793999843,7.299929318
I00742,RK9,PLYMOUTH HOSPITALS NHS TRUST,70844,12727,17714,16485,13666,5250,5002,17.96482412,25.00423466,23.26943707,19.29027158,7.410648749,7.060583818
I00742,RKB,UNIVERSITY HOSPITALS COVENTRY AND WARWICKSHIRE NHS TRUST,83567,20913,17677,15496,13050,9904,6527,25.0254287,21.15308674,18.54320485,15.61621214,11.8515682,7.81049936
I00742,RKE,THE WHITTINGTON HOSPITAL NHS TRUST,34885,13731,10833,4070,1927,426,3898,39.36075677,31.05346137,11.66690555,5.523864125,1.221155224,11.17385696
I00742,RL4,THE ROYAL WOLVERHAMPTON NHS TRUST,59774,25950,10606,7552,7057,4155,4454,43.41352427,17.74350052,12.6342557,11.80613645,6.951182789,7.451400274
I00742,RLN,CITY HOSPITALS SUNDERLAND NHS FOUNDATION TRUST,60498,24836,15993,7662,6278,2218,3511,41.05259678,26.43558465,12.66488148,10.37720255,3.6662369,5.803497636
I00742,RLQ,WYE VALLEY NHS TRUST,27570,1916,2936,11895,4906,915,5002,6.94958288,10.64925644,43.14472252,17.79470439,3.31882481,18.14290896
I00742,RLT,GEORGE ELIOT HOSPITAL NHS TRUST,24481,3958,6628,4739,3950,2814,2392,16.16764021,27.07405743,19.35786937,16.13496181,11.49462849,9.770842694
I00742,RM1,NORFOLK AND NORWICH UNIVERSITY HOSPITALS NHS FOUNDATION TRUST,87467,7537,15039,23287,21811,13322,6471,8.616964112,17.19391313,26.62375524,24.93626168,15.23088708,7.398218757
I00742,RM2,UNIVERSITY HOSPITAL OF SOUTH MANCHESTER NHS FOUNDATION TRUST,59513,18533,8107,8346,9173,10268,5086,31.14109522,13.6222338,14.02382673,15.41343908,17.25337321,8.546031959
I00742,RM3,SALFORD ROYAL NHS FOUNDATION TRUST,42717,19165,9861,6323,4150,2752,466,44.86504202,23.08448627,14.80206943,9.715101716,6.442399981,1.090900578
I00742,RMC,BOLTON NHS FOUNDATION TRUST,62593,26403,12301,7103,6166,4372,6248,42.18203313,19.65235729,11.3479143,9.850941799,6.984806608,9.981946863
I00742,RMP,TAMESIDE HOSPITAL NHS FOUNDATION TRUST,35257,13669,8971,4780,3447,1540,2850,38.76960604,25.44459256,13.5575914,9.776781916,4.367926936,8.083501149
I00742,RN3,GREAT WESTERN HOSPITALS NHS FOUNDATION TRUST,61327,5339,5710,9253,13418,17927,9680,8.705790272,9.310744044,15.08797104,21.8794332,29.23182285,15.78423859
I00742,RN5,HAMPSHIRE HOSPITALS NHS FOUNDATION TRUST,61296,466,7481,8942,11509,26265,6633,0.760245367,12.20471156,14.58822762,18.77610285,42.84945184,10.82126077
I00742,RN7,DARTFORD AND GRAVESHAM NHS TRUST,52971,5818,12115,10043,11183,8700,5112,10.98336826,22.87100489,18.95943063,21.1115516,16.4240811,9.650563516
I00742,RNA,THE DUDLEY GROUP NHS FOUNDATION TRUST,65947,21706,15343,8168,8439,7116,5175,32.91430998,23.26565272,12.38570367,12.79663973,10.79048327,7.847210639
I00742,RNL,NORTH CUMBRIA UNIVERSITY HOSPITALS NHS TRUST,44560,8896,10237,9706,7492,3935,4294,19.96409336,22.97351885,21.78186715,16.81328546,8.830789946,9.636445242
I00742,RNQ,KETTERING GENERAL HOSPITAL NHS FOUNDATION TRUST,44090,7010,10019,7390,7000,8738,3933,15.89929689,22.72397369,16.76117033,15.87661601,19.81855296,8.920390111
I00742,RNS,NORTHAMPTON GENERAL HOSPITAL NHS TRUST,57601,10157,10378,9486,9541,13748,4291,17.63337442,18.01704832,16.46846409,16.56394854,23.86764119,7.449523446
I00742,RNZ,SALISBURY NHS FOUNDATION TRUST,34606,1345,2416,9777,9620,8875,2573,3.886609259,6.981448304,28.25232619,27.79864763,25.64584176,7.435126857
I00742,RP5,DONCASTER AND BASSETLAW HOSPITALS NHS FOUNDATION TRUST,74744,27633,16834,12404,10401,1881,5591,36.97019159,22.52220914,16.595312,13.91549823,2.51658996,7.48019908
I00742,RPA,MEDWAY NHS FOUNDATION TRUST,52321,9951,16045,9310,8332,6980,1703,19.0191319,30.6664628,17.79400241,15.92477208,13.34072361,3.254907207
I00742,RQ6,ROYAL LIVERPOOL AND BROADGREEN UNIVERSITY HOSPITALS NHS TRUST,47043,28669,7054,4762,3784,1427,1347,60.94211679,14.994792,10.12265374,8.043704696,3.033394979,2.863337797
I00742,RQ8,MID ESSEX HOSPITAL SERVICES NHS TRUST,50955,2327,6678,9608,13775,13687,4880,4.566774605,13.10568148,18.8558532,27.03365715,26.86095575,9.577077814
I00742,RQM,CHELSEA AND WESTMINSTER HOSPITAL NHS FOUNDATION TRUST,44922,6481,12274,9798,7404,2154,6811,14.42722942,27.32291528,21.81113931,16.48190196,4.794977962,15.16183607
I00742,RQQ,HINCHINGBROOKE HEALTH CARE NHS TRUST,19946,177,2107,4974,3554,6719,2415,0.887395969,10.56352151,24.93733079,17.81810889,33.68595207,12.10769077
I00742,RQW,THE PRINCESS ALEXANDRA HOSPITAL NHS TRUST,38359,1306,10641,6156,7221,8377,4658,3.404676869,27.74055632,16.04838499,18.82478688,21.83842123,12.1431737
I00742,RQX,HOMERTON UNIVERSITY HOSPITAL NHS FOUNDATION TRUST,41018,27125,6482,825,397,269,5920,66.12950412,15.80281827,2.011312107,0.967867765,0.655809645,14.43268809
I00742,RR1,HEART OF ENGLAND NHS FOUNDATION TRUST,147312,65202,20061,18501,16419,16222,10907,44.26115999,13.61803519,12.55905833,11.14573151,11.01200174,7.404013251
I00742,RR7,GATESHEAD HEALTH NHS FOUNDATION TRUST,34671,13644,9320,3366,4734,1770,1837,39.35277321,26.88125523,9.708401834,13.65406247,5.105131089,5.298376165
I00742,RR8,LEEDS TEACHING HOSPITALS NHS TRUST,126278,43392,22634,16575,19943,13048,10686,34.36228005,17.92394558,13.1258018,15.79293305,10.33275788,8.462281633
I00742,RRF,"WRIGHTINGTON, WIGAN AND LEIGH NHS FOUNDATION TRUST",45244,15256,10247,5715,6673,4033,3320,33.71938821,22.64830696,12.63150915,14.74891698,8.913889134,7.337989568
I00742,RRK,UNIVERSITY HOSPITALS BIRMINGHAM NHS FOUNDATION TRUST,58337,23347,11966,12273,5629,3930,1192,40.02091297,20.51185354,21.03810618,9.64910777,6.736719406,2.043300135
I00742,RRV,UNIVERSITY COLLEGE LONDON HOSPITALS NHS FOUNDATION TRUST,68179,17747,18173,10487,7438,5435,8899,26.03000924,26.65483507,15.3815691,10.90951759,7.971662829,13.05240617
I00742,RTD,THE NEWCASTLE UPON TYNE HOSPITALS NHS FOUNDATION TRUST,105262,33369,21710,13990,14675,12784,8734,31.70089871,20.62472687,13.2906462,13.94140336,12.14493359,8.297391271
I00742,RTE,GLOUCESTERSHIRE HOSPITALS NHS FOUNDATION TRUST,82732,8332,9853,18822,18261,20661,6803,10.07107286,11.90953924,22.7505681,22.07247498,24.97340811,8.222936711
I00742,RTF,NORTHUMBRIA HEALTHCARE NHS FOUNDATION TRUST,61691,14802,14440,11481,9258,8883,2827,23.99377543,23.40697995,18.61049424,15.00705127,14.39918303,4.582516088
I00742,RTG,DERBY HOSPITALS NHS FOUNDATION TRUST,80588,15539,14549,16293,12814,14509,6884,19.2820271,18.05355636,20.21765027,15.90063037,18.00392118,8.542214722
I00742,RTH,OXFORD UNIVERSITY HOSPITALS NHS TRUST,110281,7122,11571,18009,24328,39617,9634,6.458048077,10.49228788,16.33010219,22.06001034,35.92368586,8.735865652
I00742,RTK,ASHFORD AND ST. PETER'S HOSPITALS NHS FOUNDATION TRUST,45138,468,4651,7306,9694,18588,4431,1.036820417,10.30395675,16.18591874,21.47636138,41.18038017,9.816562542
I00742,RTP,SURREY AND SUSSEX HEALTHCARE NHS TRUST,50601,697,5562,12194,11596,15676,4876,1.377443134,10.99187763,24.09833798,22.91654315,30.97962491,9.636173198
I00742,RTR,SOUTH TEES HOSPITALS NHS FOUNDATION TRUST,90773,32190,13472,11364,15950,12110,5687,35.46208674,14.8414176,12.51914115,17.57130424,13.34097143,6.265078823
I00742,RTX,UNIVERSITY HOSPITALS OF MORECAMBE BAY NHS FOUNDATION TRUST,53935,11596,9387,12544,13372,6324,712,21.49995365,17.40428293,23.25762492,24.79280616,11.72522481,1.320107537
I00742,RV8,NORTH WEST LONDON HOSPITALS NHS TRUST,68836,8895,21433,19232,9183,4825,5268,12.92201755,31.13632402,27.9388692,13.34040328,7.009413679,7.652972282
I00742,RVJ,NORTH BRISTOL NHS TRUST,71323,7825,13716,12561,12182,17969,7070,10.97121546,19.23082316,17.61142969,17.08004431,25.19383649,9.912650898
I00742,RVL,BARNET AND CHASE FARM HOSPITALS NHS TRUST,71482,7622,15326,19234,14896,7283,7121,10.66282421,21.44036261,26.90747321,20.83881257,10.18857894,9.961948463
I00742,RVR,EPSOM AND ST HELIER UNIVERSITY HOSPITALS NHS TRUST,55699,2086,9889,10087,11362,16817,5458,3.745130074,17.75435825,18.10984039,20.39892996,30.1926426,9.799098727
I00742,RVV,EAST KENT HOSPITALS UNIVERSITY NHS FOUNDATION TRUST,103374,18571,21095,25404,24075,6644,7585,17.96486544,20.40648519,24.57484474,23.28922166,6.427148026,7.337434945
I00742,RVW,NORTH TEES AND HARTLEPOOL NHS FOUNDATION TRUST,49283,20584,9332,6190,4155,5388,3634,41.76693789,18.93553558,12.56011201,8.430899093,10.93277601,7.373739423
I00742,RVY,SOUTHPORT AND ORMSKIRK HOSPITAL NHS TRUST,35685,5448,6579,7468,7834,5127,3229,15.26691887,18.43631778,20.9275606,21.95320163,14.36738125,9.048619868
I00742,RW3,CENTRAL MANCHESTER UNIVERSITY HOSPITALS NHS FOUNDATION TRUST,100669,44544,19447,11936,8081,5920,10741,44.24798101,19.31776416,11.85667882,8.027297381,5.880658395,10.66962024
I00742,RW6,PENNINE ACUTE HOSPITALS NHS TRUST,130010,60604,23844,15888,11942,5802,11930,46.61487578,18.34012768,12.22059842,9.185447273,4.462733636,9.176217214
I00742,RWA,HULL AND EAST YORKSHIRE HOSPITALS NHS TRUST,89983,29977,12818,14740,13861,12436,6151,33.31407044,14.24491293,16.38087194,15.40402076,13.8203883,6.835735639
I00742,RWD,UNITED LINCOLNSHIRE HOSPITALS NHS TRUST,88452,14634,19715,21089,18174,11217,3623,16.54456654,22.28892507,23.84230995,20.54673721,12.68145435,4.096006874
I00742,RWE,UNIVERSITY HOSPITALS OF LEICESTER NHS TRUST,140149,25433,26518,20423,25105,28795,13875,18.14711486,18.92129091,14.572348,17.91307822,20.54599034,9.900177668
I00742,RWF,MAIDSTONE AND TUNBRIDGE WELLS NHS TRUST,60261,2105,5374,11666,16484,18803,5829,3.493138182,8.917873915,19.35912116,27.35434195,31.20260201,9.672922786
I00742,RWG,WEST HERTFORDSHIRE HOSPITALS NHS TRUST,57981,606,7793,12785,11018,19593,6186,1.045169969,13.44060985,22.05032683,19.00277677,33.79210431,10.66901226
I00742,RWH,EAST AND NORTH HERTFORDSHIRE NHS TRUST,59442,1302,7579,14789,12578,18566,4628,2.190370445,12.75024394,24.87971468,21.16012247,31.23380775,7.785740722
I00742,RWJ,STOCKPORT NHS FOUNDATION TRUST,58509,10411,11440,11053,9981,11790,3834,17.79384368,19.55254747,18.89111077,17.05891401,20.15074604,6.552838025
I00742,RWP,WORCESTERSHIRE ACUTE HOSPITALS NHS TRUST,74676,9536,10494,17148,18137,12511,6850,12.76983234,14.0527077,22.96320103,24.28758905,16.75370936,9.172960523
I00742,RWW,WARRINGTON AND HALTON HOSPITALS NHS FOUNDATION TRUST,50826,16164,8187,5309,9145,8282,3739,31.80262071,16.10789753,10.44544131,17.99275961,16.29480974,7.356471097
I00742,RWY,CALDERDALE AND HUDDERSFIELD NHS FOUNDATION TRUST,75991,19750,18292,10831,13321,7657,6140,25.98991986,24.0712716,14.25300365,17.52970747,10.07619323,8.079904199
I00742,RX1,NOTTINGHAM UNIVERSITY HOSPITALS NHS TRUST,128221,34338,24910,20953,19758,21617,6645,26.7803246,19.42739489,16.34131694,15.40933232,16.85917283,5.182458412
I00742,RXC,EAST SUSSEX HEALTHCARE NHS TRUST,56863,10107,15099,12339,10368,4689,4261,17.77429963,26.55329476,21.69952342,18.23329757,8.246135448,7.493449167
I00742,RXF,MID YORKSHIRE HOSPITALS NHS TRUST,96675,31167,25723,15228,13327,4809,6421,32.23894492,26.60770623,15.75174554,13.78536333,4.974398759,6.641841221
I00742,RXH,BRIGHTON AND SUSSEX UNIVERSITY HOSPITALS NHS TRUST,68553,9416,14281,14227,11664,12371,6594,13.73535804,20.83205695,20.75328578,17.01457267,18.0458915,9.618835062
I00742,RXK,SANDWELL AND WEST BIRMINGHAM HOSPITALS NHS TRUST,74304,44282,12914,7701,2013,807,6587,59.5957149,17.37995263,10.36417959,2.709140827,1.086078811,8.864933247
I00742,RXL,BLACKPOOL TEACHING HOSPITALS NHS FOUNDATION TRUST,54727,17842,10325,9203,8077,5777,3503,32.6018236,18.86637309,16.81619676,14.75871142,10.55603267,6.400862463
I00742,RXN,LANCASHIRE TEACHING HOSPITALS NHS FOUNDATION TRUST,73014,17926,11784,12360,13724,11964,5256,24.55145589,16.13937053,16.92826033,18.79639521,16.38589859,7.198619443
I00742,RXP,COUNTY DURHAM AND DARLINGTON NHS FOUNDATION TRUST,85064,25228,24006,12507,9038,8563,5722,29.65766952,28.22110411,14.70304712,10.62494122,10.06653814,6.726699897
I00742,RXQ,BUCKINGHAMSHIRE HEALTHCARE NHS TRUST,48585,264,7373,7012,7771,20422,5743,0.543377586,15.17546568,14.432438,15.99464855,42.03354945,11.82052074
I00742,RXR,EAST LANCASHIRE HOSPITALS NHS TRUST,81544,36240,15947,7557,10555,4293,6952,44.4422643,19.55631316,9.267389385,12.94393211,5.264642402,8.525458648
I00742,RXW,SHREWSBURY AND TELFORD HOSPITAL NHS TRUST,63013,7481,12518,15257,10491,6546,10720,11.87215337,19.86574199,24.21246409,16.64894546,10.38833257,17.01236253
I00742,RYJ,IMPERIAL COLLEGE HEALTHCARE NHS TRUST,101386,25578,29417,17181,11242,5185,12783,25.22833527,29.01485412,16.94612668,11.08831594,5.11411832,12.60824966
I00742,RYR,WESTERN SUSSEX HOSPITALS NHS FOUNDATION TRUST,70616,4698,11908,21639,15620,10762,5989,6.652883199,16.86303387,30.64319701,22.11963294,15.2401722,8.481080775
