INDICATOR_CODE,PROVIDER_CODE,PROVIDER_NAME,NUMERATOR,DENOMINATOR,RATE
I00732,ENG,"ENGLAND",283238,7594459,3.7295
I00732,REM,"AINTREE UNIVERSITY HOSPITAL NHS FOUNDATION TRUST",2081,40183,5.1788
I00732,RCF,"AIREDALE NHS FOUNDATION TRUST",1012,31737,3.1887
I00732,RTK,"ASHFORD AND ST PETER'S HOSPITALS NHS FOUNDATION TRUST",1706,35320,4.8301
I00732,RF4,"BARKING, HAVERING AND REDBRIDGE UNIVERSITY HOSPITALS NHS TRUST",3246,74889,4.3344
I00732,RFF,"BARNSLEY HOSPITAL NHS FOUNDATION TRUST",1425,38036,3.7465
I00732,R1H,"BARTS HEALTH NHS TRUST",3585,135331,2.6491
I00732,RDD,"BASILDON AND THURROCK UNIVERSITY HOSPITALS NHS FOUNDATION TRUST",2106,48900,4.3067
I00732,RC1,"BEDFORD HOSPITAL NHS TRUST",1171,30408,3.8510
I00732,RXL,"BLACKPOOL TEACHING HOSPITALS NHS FOUNDATION TRUST",2337,49448,4.7262
I00732,RMC,"BOLTON NHS FOUNDATION TRUST",1683,58717,2.8663
I00732,RAE,"BRADFORD TEACHING HOSPITALS NHS FOUNDATION TRUST",1826,65982,2.7674
I00732,RXH,"BRIGHTON AND SUSSEX UNIVERSITY HOSPITALS NHS TRUST",2403,60354,3.9815
I00732,RXQ,"BUCKINGHAMSHIRE HEALTHCARE NHS TRUST",1522,50899,2.9902
I00732,RJF,"BURTON HOSPITALS NHS FOUNDATION TRUST",1276,38665,3.3001
I00732,RWY,"CALDERDALE AND HUDDERSFIELD NHS FOUNDATION TRUST",2257,58260,3.8740
I00732,RGT,"CAMBRIDGE UNIVERSITY HOSPITALS NHS FOUNDATION TRUST",2113,56373,3.7482
I00732,RW3,"CENTRAL MANCHESTER UNIVERSITY HOSPITALS NHS FOUNDATION TRUST",1618,85377,1.8951
I00732,RQM,"CHELSEA AND WESTMINSTER HOSPITAL NHS FOUNDATION TRUST",1496,81294,1.8402
I00732,RFS,"CHESTERFIELD ROYAL HOSPITAL NHS FOUNDATION TRUST",1840,45528,4.0415
I00732,RLN,"CITY HOSPITALS SUNDERLAND NHS FOUNDATION TRUST",2031,44865,4.5269
I00732,RDE,"COLCHESTER HOSPITAL UNIVERSITY NHS FOUNDATION TRUST",2279,50352,4.5261
I00732,RJR,"COUNTESS OF CHESTER HOSPITAL NHS FOUNDATION TRUST",1493,43427,3.4380
I00732,RXP,"COUNTY DURHAM AND DARLINGTON NHS FOUNDATION TRUST",3024,73898,4.0921
I00732,RJ6,"CROYDON HEALTH SERVICES NHS TRUST",1270,40993,3.0981
I00732,RN7,"DARTFORD AND GRAVESHAM NHS TRUST",1405,42013,3.3442
I00732,RTG,"DERBY TEACHING HOSPITALS NHS FOUNDATION TRUST",3240,73983,4.3794
I00732,RP5,"DONCASTER AND BASSETLAW TEACHING HOSPITALS NHS FOUNDATION TRUST",2852,66454,4.2917
I00732,RBD,"DORSET COUNTY HOSPITAL NHS FOUNDATION TRUST",1163,27197,4.2762
I00732,RWH,"EAST AND NORTH HERTFORDSHIRE NHS TRUST",2336,57781,4.0429
I00732,RJN,"EAST CHESHIRE NHS TRUST",965,18746,5.1478
I00732,RVV,"EAST KENT HOSPITALS UNIVERSITY NHS FOUNDATION TRUST",4062,91543,4.4373
I00732,RXR,"EAST LANCASHIRE HOSPITALS NHS TRUST",2604,69527,3.7453
I00732,RXC,"EAST SUSSEX HEALTHCARE NHS TRUST",2516,46157,5.4510
I00732,RVR,"EPSOM AND ST HELIER UNIVERSITY HOSPITALS NHS TRUST",1911,52407,3.6465
I00732,RDU,"FRIMLEY HEALTH NHS FOUNDATION TRUST",3474,110627,3.1403
I00732,RR7,"GATESHEAD HEALTH NHS FOUNDATION TRUST",1445,29624,4.8778
I00732,RLT,"GEORGE ELIOT HOSPITAL NHS TRUST",992,19358,5.1245
I00732,RTE,"GLOUCESTERSHIRE HOSPITALS NHS FOUNDATION TRUST",3089,73515,4.2019
I00732,RN3,"GREAT WESTERN HOSPITALS NHS FOUNDATION TRUST",1757,50813,3.4578
I00732,RJ1,"GUY'S AND ST THOMAS' NHS FOUNDATION TRUST",1343,60386,2.2240
I00732,RN5,"HAMPSHIRE HOSPITALS NHS FOUNDATION TRUST",1878,52263,3.5934
I00732,RCD,"HARROGATE AND DISTRICT NHS FOUNDATION TRUST",906,22446,4.0364
I00732,RR1,"HEART OF ENGLAND NHS FOUNDATION TRUST",4492,150450,2.9857
I00732,RQX,"HOMERTON UNIVERSITY HOSPITAL NHS FOUNDATION TRUST",511,41068,1.2443
I00732,RWA,"HULL AND EAST YORKSHIRE HOSPITALS NHS TRUST",3245,66884,4.8517
I00732,RYJ,"IMPERIAL COLLEGE HEALTHCARE NHS TRUST",2130,90037,2.3657
I00732,RGQ,"IPSWICH HOSPITAL NHS TRUST",1885,47188,3.9947
I00732,R1F,"ISLE OF WIGHT NHS TRUST",906,14720,6.1549
I00732,RGP,"JAMES PAGET UNIVERSITY HOSPITALS NHS FOUNDATION TRUST",1577,25907,6.0872
I00732,RNQ,"KETTERING GENERAL HOSPITAL NHS FOUNDATION TRUST",1592,46680,3.4105
I00732,RJZ,"KING'S COLLEGE HOSPITAL NHS FOUNDATION TRUST",3067,87576,3.5021
I00732,RAX,"KINGSTON HOSPITAL NHS FOUNDATION TRUST",1136,49327,2.3030
I00732,RXN,"LANCASHIRE TEACHING HOSPITALS NHS FOUNDATION TRUST",2203,66731,3.3013
I00732,RR8,"LEEDS TEACHING HOSPITALS NHS TRUST",4038,106294,3.7989
I00732,RJ2,"LEWISHAM AND GREENWICH NHS TRUST",2323,82877,2.8029
I00732,R1K,"LONDON NORTH WEST HEALTHCARE NHS TRUST",2478,84873,2.9197
I00732,RC9,"LUTON AND DUNSTABLE UNIVERSITY HOSPITAL NHS FOUNDATION TRUST",1672,65242,2.5628
I00732,RWF,"MAIDSTONE AND TUNBRIDGE WELLS NHS TRUST",2336,56606,4.1268
I00732,RPA,"MEDWAY NHS FOUNDATION TRUST",1903,48542,3.9203
I00732,RBT,"MID CHESHIRE HOSPITALS NHS FOUNDATION TRUST",1553,46303,3.3540
I00732,RQ8,"MID ESSEX HOSPITAL SERVICES NHS TRUST",1865,45241,4.1224
I00732,RXF,"MID YORKSHIRE HOSPITALS NHS TRUST",2994,90206,3.3191
I00732,RD8,"MILTON KEYNES UNIVERSITY HOSPITAL NHS FOUNDATION TRUST",1200,37736,3.1800
I00732,RM1,"NORFOLK AND NORWICH UNIVERSITY HOSPITALS NHS FOUNDATION TRUST",3502,75708,4.6257
I00732,RVJ,"NORTH BRISTOL NHS TRUST",2211,67313,3.2847
I00732,RNL,"NORTH CUMBRIA UNIVERSITY HOSPITALS NHS TRUST",1782,39564,4.5041
I00732,RAP,"NORTH MIDDLESEX UNIVERSITY HOSPITAL NHS TRUST",1219,44275,2.7532
I00732,RVW,"NORTH TEES AND HARTLEPOOL NHS FOUNDATION TRUST",2061,51844,3.9754
I00732,RGN,"NORTH WEST ANGLIA NHS FOUNDATION TRUST",2750,63967,4.2991
I00732,RNS,"NORTHAMPTON GENERAL HOSPITAL NHS TRUST",1807,65082,2.7765
I00732,RBZ,"NORTHERN DEVON HEALTHCARE NHS TRUST",1116,25021,4.4603
I00732,RJL,"NORTHERN LINCOLNSHIRE AND GOOLE NHS FOUNDATION TRUST",2437,48738,5.0002
I00732,RTF,"NORTHUMBRIA HEALTHCARE NHS FOUNDATION TRUST",3059,58619,5.2184
I00732,RX1,"NOTTINGHAM UNIVERSITY HOSPITALS NHS TRUST",4323,105277,4.1063
I00732,RTH,"OXFORD UNIVERSITY HOSPITALS NHS FOUNDATION TRUST",3130,95131,3.2902
I00732,RW6,"PENNINE ACUTE HOSPITALS NHS TRUST",3901,101237,3.8533
I00732,RK9,"PLYMOUTH HOSPITALS NHS TRUST",2313,58983,3.9215
I00732,RD3,"POOLE HOSPITAL NHS FOUNDATION TRUST",1591,47473,3.3514
I00732,RHU,"PORTSMOUTH HOSPITALS NHS TRUST",3087,67741,4.5571
I00732,RHW,"ROYAL BERKSHIRE NHS FOUNDATION TRUST",2110,59552,3.5431
I00732,REF,"ROYAL CORNWALL HOSPITALS NHS TRUST",2355,60846,3.8704
I00732,RH8,"ROYAL DEVON AND EXETER NHS FOUNDATION TRUST",1963,49650,3.9537
I00732,RAL,"ROYAL FREE LONDON NHS FOUNDATION TRUST",2670,67778,3.9393
I00732,RQ6,"ROYAL LIVERPOOL AND BROADGREEN UNIVERSITY HOSPITALS NHS TRUST",1899,37111,5.1171
I00732,RA2,"ROYAL SURREY COUNTY HOSPITAL NHS FOUNDATION TRUST",1215,35069,3.4646
I00732,RD1,"ROYAL UNITED HOSPITALS BATH NHS FOUNDATION TRUST",2005,49538,4.0474
I00732,RM3,"SALFORD ROYAL NHS FOUNDATION TRUST",1803,40610,4.4398
I00732,RNZ,"SALISBURY NHS FOUNDATION TRUST",1027,29564,3.4738
I00732,RXK,"SANDWELL AND WEST BIRMINGHAM HOSPITALS NHS TRUST",2094,63037,3.3219
I00732,RHQ,"SHEFFIELD TEACHING HOSPITALS NHS FOUNDATION TRUST",3465,86978,3.9838
I00732,RK5,"SHERWOOD FOREST HOSPITALS NHS FOUNDATION TRUST",1948,50274,3.8748
I00732,RXW,"SHREWSBURY AND TELFORD HOSPITAL NHS TRUST",2631,62109,4.2361
I00732,RTR,"SOUTH TEES HOSPITALS NHS FOUNDATION TRUST",2698,70324,3.8365
I00732,RE9,"SOUTH TYNESIDE NHS FOUNDATION TRUST",1018,23059,4.4148
I00732,RJC,"SOUTH WARWICKSHIRE NHS FOUNDATION TRUST",1195,28847,4.1425
I00732,RAJ,"SOUTHEND UNIVERSITY HOSPITAL NHS FOUNDATION TRUST",2279,45546,5.0037
I00732,RVY,"SOUTHPORT AND ORMSKIRK HOSPITAL NHS TRUST",1340,29414,4.5557
I00732,RJ7,"ST GEORGE'S UNIVERSITY HOSPITALS NHS FOUNDATION TRUST",1918,68103,2.8163
I00732,RBN,"ST HELENS AND KNOWSLEY HOSPITAL SERVICES NHS TRUST",2314,64593,3.5824
I00732,RWJ,"STOCKPORT NHS FOUNDATION TRUST",1731,49503,3.4968
I00732,RTP,"SURREY AND SUSSEX HEALTHCARE NHS TRUST",1907,44486,4.2867
I00732,RMP,"TAMESIDE AND GLOSSOP INTEGRATED CARE NHS FOUNDATION TRUST",1358,31142,4.3607
I00732,RBA,"TAUNTON AND SOMERSET NHS FOUNDATION TRUST",1757,47034,3.7356
I00732,RNA,"THE DUDLEY GROUP NHS FOUNDATION TRUST",2350,72892,3.2239
I00732,RAS,"THE HILLINGDON HOSPITALS NHS FOUNDATION TRUST",947,35784,2.6464
I00732,RTD,"THE NEWCASTLE UPON TYNE HOSPITALS NHS FOUNDATION TRUST",2538,73814,3.4384
I00732,RQW,"THE PRINCESS ALEXANDRA HOSPITAL NHS TRUST",1495,41128,3.6350
I00732,RCX,"THE QUEEN ELIZABETH HOSPITAL, KING'S LYNN, NHS FOUNDATION TRUST",1637,40417,4.0503
I00732,RFR,"THE ROTHERHAM NHS FOUNDATION TRUST",1495,34874,4.2869
I00732,RDZ,"THE ROYAL BOURNEMOUTH AND CHRISTCHURCH HOSPITALS NHS FOUNDATION TRUST",1944,37000,5.2541
I00732,RL4,"THE ROYAL WOLVERHAMPTON NHS TRUST",2466,62726,3.9314
I00732,RKE,"THE WHITTINGTON HOSPITAL NHS TRUST",506,25342,1.9967
I00732,RA9,"TORBAY AND SOUTH DEVON NHS FOUNDATION TRUST",1755,44207,3.9700
I00732,RWD,"UNITED LINCOLNSHIRE HOSPITALS NHS TRUST",3574,72720,4.9147
I00732,RRV,"UNIVERSITY COLLEGE LONDON HOSPITALS NHS FOUNDATION TRUST",966,47726,2.0241
I00732,RM2,"UNIVERSITY HOSPITAL OF SOUTH MANCHESTER NHS FOUNDATION TRUST",1801,51917,3.4690
I00732,RHM,"UNIVERSITY HOSPITAL SOUTHAMPTON NHS FOUNDATION TRUST",2796,74484,3.7538
I00732,RRK,"UNIVERSITY HOSPITALS BIRMINGHAM NHS FOUNDATION TRUST",2580,48064,5.3678
I00732,RA7,"UNIVERSITY HOSPITALS BRISTOL NHS FOUNDATION TRUST",1573,61475,2.5588
I00732,RKB,"UNIVERSITY HOSPITALS COVENTRY AND WARWICKSHIRE NHS TRUST",2819,81578,3.4556
I00732,RWE,"UNIVERSITY HOSPITALS OF LEICESTER NHS TRUST",4420,130073,3.3981
I00732,RTX,"UNIVERSITY HOSPITALS OF MORECAMBE BAY NHS FOUNDATION TRUST",1883,44980,4.1863
I00732,RJE,"UNIVERSITY HOSPITALS OF NORTH MIDLANDS NHS TRUST",4103,114111,3.5956
I00732,RBK,"WALSALL HEALTHCARE NHS TRUST",1561,41761,3.7379
I00732,RWW,"WARRINGTON AND HALTON HOSPITALS NHS FOUNDATION TRUST",1492,44436,3.3576
I00732,RWG,"WEST HERTFORDSHIRE HOSPITALS NHS TRUST",1925,54306,3.5447
I00732,RGR,"WEST SUFFOLK NHS FOUNDATION TRUST",1417,32607,4.3457
I00732,RYR,"WESTERN SUSSEX HOSPITALS NHS FOUNDATION TRUST",3121,68531,4.5541
I00732,RA3,"WESTON AREA HEALTH NHS TRUST",987,15564,6.3416
I00732,RBL,"WIRRAL UNIVERSITY TEACHING HOSPITAL NHS FOUNDATION TRUST",2252,58060,3.8787
I00732,RWP,"WORCESTERSHIRE ACUTE HOSPITALS NHS TRUST",2795,62691,4.4584
I00732,RRF,"WRIGHTINGTON, WIGAN AND LEIGH NHS FOUNDATION TRUST",1788,32831,5.4461
I00732,RLQ,"WYE VALLEY NHS TRUST",1222,23269,5.2516
I00732,RA4,"YEOVIL DISTRICT HOSPITAL NHS FOUNDATION TRUST",1017,22873,4.4463
I00732,RCB,"YORK TEACHING HOSPITAL NHS FOUNDATION TRUST",3180,77514,4.1025
