INDICATOR_CODE,PROVIDER_CODE,PROVIDER_NAME,NUMERATOR,DENOMINATOR,RATE
I01963,ENG,"ENGLAND",81068,9265338,0.9
I01963,REM,"AINTREE UNIVERSITY HOSPITAL NHS FOUNDATION TRUST",45,62600,0.1
I01963,RCF,"AIREDALE NHS FOUNDATION TRUST",*,33230,*
I01963,RTK,"ASHFORD AND ST PETER'S HOSPITALS NHS FOUNDATION TRUST",*,41810,*
I01963,RF4,"BARKING, HAVERING AND REDBRIDGE UNIVERSITY HOSPITALS NHS TRUST",55,85575,0.1
I01963,RFF,"BARNSLEY HOSPITAL NHS FOUNDATION TRUST",*,45885,*
I01963,R1H,"BARTS HEALTH NHS TRUST",505,175470,0.3
I01963,RDD,"BASILDON AND THURROCK UNIVERSITY HOSPITALS NHS FOUNDATION TRUST",80,79520,0.1
I01963,RC1,"BEDFORD HOSPITAL NHS TRUST",0,36495,0.0
I01963,RXL,"BLACKPOOL TEACHING HOSPITALS NHS FOUNDATION TRUST",35,54465,0.1
I01963,RMC,"BOLTON NHS FOUNDATION TRUST",205,60800,0.3
I01963,RAE,"BRADFORD TEACHING HOSPITALS NHS FOUNDATION TRUST",3200,97625,3.3
I01963,RXH,"BRIGHTON AND SUSSEX UNIVERSITY HOSPITALS NHS TRUST",40,68980,0.1
I01963,RXQ,"BUCKINGHAMSHIRE HEALTHCARE NHS TRUST",1345,63735,2.1
I01963,RWY,"CALDERDALE AND HUDDERSFIELD NHS FOUNDATION TRUST",15,71195,0.0
I01963,RGT,"CAMBRIDGE UNIVERSITY HOSPITALS NHS FOUNDATION TRUST",45,76110,0.1
I01963,RQM,"CHELSEA AND WESTMINSTER HOSPITAL NHS FOUNDATION TRUST",540,94100,0.6
I01963,RFS,"CHESTERFIELD ROYAL HOSPITAL NHS FOUNDATION TRUST",40,51145,0.1
I01963,RJR,"COUNTESS OF CHESTER HOSPITAL NHS FOUNDATION TRUST",30,48370,0.1
I01963,RXP,"COUNTY DURHAM AND DARLINGTON NHS FOUNDATION TRUST",0,82480,0.0
I01963,RJ6,"CROYDON HEALTH SERVICES NHS TRUST",30,37280,0.1
I01963,RN7,"DARTFORD AND GRAVESHAM NHS TRUST",170,57880,0.3
I01963,RP5,"DONCASTER AND BASSETLAW TEACHING HOSPITALS NHS FOUNDATION TRUST",40,73675,0.1
I01963,RBD,"DORSET COUNTY HOSPITAL NHS FOUNDATION TRUST",10,29255,0.0
I01963,RWH,"EAST AND NORTH HERTFORDSHIRE NHS TRUST",10,67445,0.0
I01963,RJN,"EAST CHESHIRE NHS TRUST",0,19715,0.0
I01963,RVV,"EAST KENT HOSPITALS UNIVERSITY NHS FOUNDATION TRUST",525,108120,0.5
I01963,RXR,"EAST LANCASHIRE HOSPITALS NHS TRUST",50,82820,0.1
I01963,RDE,"EAST SUFFOLK AND NORTH ESSEX NHS FOUNDATION TRUST",150,109845,0.1
I01963,RXC,"EAST SUSSEX HEALTHCARE NHS TRUST",40925,62155,65.8
I01963,RVR,"EPSOM AND ST HELIER UNIVERSITY HOSPITALS NHS TRUST",45,62900,0.1
I01963,RDU,"FRIMLEY HEALTH NHS FOUNDATION TRUST",170,130935,0.1
I01963,RR7,"GATESHEAD HEALTH NHS FOUNDATION TRUST",15,32970,0.0
I01963,RLT,"GEORGE ELIOT HOSPITAL NHS TRUST",180,24180,0.7
I01963,RTE,"GLOUCESTERSHIRE HOSPITALS NHS FOUNDATION TRUST",380,90035,0.4
I01963,RN3,"GREAT WESTERN HOSPITALS NHS FOUNDATION TRUST",40,63630,0.1
I01963,RJ1,"GUY'S AND ST THOMAS' NHS FOUNDATION TRUST",75,93985,0.1
I01963,RN5,"HAMPSHIRE HOSPITALS NHS FOUNDATION TRUST",*,64550,*
I01963,RCD,"HARROGATE AND DISTRICT NHS FOUNDATION TRUST",25,27105,0.1
I01963,RQX,"HOMERTON UNIVERSITY HOSPITAL NHS FOUNDATION TRUST",35,45740,0.1
I01963,RWA,"HULL UNIVERSITY TEACHING HOSPITALS NHS TRUST",10,85055,0.0
I01963,RYJ,"IMPERIAL COLLEGE HEALTHCARE NHS TRUST",495,108285,0.5
I01963,R1F,"ISLE OF WIGHT NHS TRUST",265,17550,1.5
I01963,RGP,"JAMES PAGET UNIVERSITY HOSPITALS NHS FOUNDATION TRUST",105,33520,0.3
I01963,RNQ,"KETTERING GENERAL HOSPITAL NHS FOUNDATION TRUST",10,52645,0.0
I01963,RJZ,"KING'S COLLEGE HOSPITAL NHS FOUNDATION TRUST",395,113710,0.3
I01963,RAX,"KINGSTON HOSPITAL NHS FOUNDATION TRUST",35,59135,0.1
I01963,RXN,"LANCASHIRE TEACHING HOSPITALS NHS FOUNDATION TRUST",80,79450,0.1
I01963,RR8,"LEEDS TEACHING HOSPITALS NHS TRUST",0,125170,0.0
I01963,RJ2,"LEWISHAM AND GREENWICH NHS TRUST",435,91320,0.5
I01963,R1K,"LONDON NORTH WEST UNIVERSITY HEALTHCARE NHS TRUST",310,105010,0.3
I01963,RC9,"LUTON AND DUNSTABLE UNIVERSITY HOSPITAL NHS FOUNDATION TRUST",*,81200,*
I01963,RWF,"MAIDSTONE AND TUNBRIDGE WELLS NHS TRUST",15,76215,0.0
I01963,R0A,"MANCHESTER UNIVERSITY NHS FOUNDATION TRUST",175,177505,0.1
I01963,RPA,"MEDWAY NHS FOUNDATION TRUST",50,56060,0.1
I01963,RBT,"MID CHESHIRE HOSPITALS NHS FOUNDATION TRUST",65,51210,0.1
I01963,RQ8,"MID ESSEX HOSPITAL SERVICES NHS TRUST",115,55915,0.2
I01963,RXF,"MID YORKSHIRE HOSPITALS NHS TRUST",515,94515,0.5
I01963,RD8,"MILTON KEYNES UNIVERSITY HOSPITAL NHS FOUNDATION TRUST",8680,50245,17.3
I01963,RM1,"NORFOLK AND NORWICH UNIVERSITY HOSPITALS NHS FOUNDATION TRUST",130,90590,0.1
I01963,RVJ,"NORTH BRISTOL NHS TRUST",455,89165,0.5
I01963,RNL,"NORTH CUMBRIA UNIVERSITY HOSPITALS NHS TRUST",*,46720,*
I01963,RAP,"NORTH MIDDLESEX UNIVERSITY HOSPITAL NHS TRUST",15,49015,0.0
I01963,RVW,"NORTH TEES AND HARTLEPOOL NHS FOUNDATION TRUST",*,60840,*
I01963,RGN,"NORTH WEST ANGLIA NHS FOUNDATION TRUST",30,81200,0.0
I01963,RNS,"NORTHAMPTON GENERAL HOSPITAL NHS TRUST",240,74075,0.3
I01963,RBZ,"NORTHERN DEVON HEALTHCARE NHS TRUST",1015,31350,3.2
I01963,RJL,"NORTHERN LINCOLNSHIRE AND GOOLE NHS FOUNDATION TRUST",25,59010,0.0
I01963,RTF,"NORTHUMBRIA HEALTHCARE NHS FOUNDATION TRUST",40,74510,0.1
I01963,RX1,"NOTTINGHAM UNIVERSITY HOSPITALS NHS TRUST",80,137110,0.1
I01963,RTH,"OXFORD UNIVERSITY HOSPITALS NHS FOUNDATION TRUST",0,118520,0.0
I01963,RW6,"PENNINE ACUTE HOSPITALS NHS TRUST",125,130730,0.1
I01963,RD3,"POOLE HOSPITAL NHS FOUNDATION TRUST",45,51655,0.1
I01963,RHU,"PORTSMOUTH HOSPITALS NHS TRUST",1175,83385,1.4
I01963,RHW,"ROYAL BERKSHIRE NHS FOUNDATION TRUST",435,68795,0.6
I01963,REF,"ROYAL CORNWALL HOSPITALS NHS TRUST",425,72830,0.6
I01963,RH8,"ROYAL DEVON AND EXETER NHS FOUNDATION TRUST",15,62905,0.0
I01963,RAL,"ROYAL FREE LONDON NHS FOUNDATION TRUST",3890,105390,3.7
I01963,RQ6,"ROYAL LIVERPOOL AND BROADGREEN UNIVERSITY HOSPITALS NHS TRUST",55,50410,0.1
I01963,RA2,"ROYAL SURREY COUNTY HOSPITAL NHS FOUNDATION TRUST",15,48905,0.0
I01963,RD1,"ROYAL UNITED HOSPITALS BATH NHS FOUNDATION TRUST",1920,61455,3.1
I01963,RM3,"SALFORD ROYAL NHS FOUNDATION TRUST",155,50050,0.3
I01963,RNZ,"SALISBURY NHS FOUNDATION TRUST",10,37400,0.0
I01963,RXK,"SANDWELL AND WEST BIRMINGHAM HOSPITALS NHS TRUST",*,70215,*
I01963,RHQ,"SHEFFIELD TEACHING HOSPITALS NHS FOUNDATION TRUST",155,114845,0.1
I01963,RK5,"SHERWOOD FOREST HOSPITALS NHS FOUNDATION TRUST",20,56835,0.0
I01963,RXW,"SHREWSBURY AND TELFORD HOSPITAL NHS TRUST",0,71445,0.0
I01963,RTR,"SOUTH TEES HOSPITALS NHS FOUNDATION TRUST",45,86825,0.1
I01963,R0B,"SOUTH TYNESIDE AND SUNDERLAND NHS FOUNDATION TRUST",35,80165,0.0
I01963,RJC,"SOUTH WARWICKSHIRE NHS FOUNDATION TRUST",30,36515,0.1
I01963,RAJ,"SOUTHEND UNIVERSITY HOSPITAL NHS FOUNDATION TRUST",20,57660,0.0
I01963,RVY,"SOUTHPORT AND ORMSKIRK HOSPITAL NHS TRUST",10,37530,0.0
I01963,RJ7,"ST GEORGE'S UNIVERSITY HOSPITALS NHS FOUNDATION TRUST",390,88960,0.4
I01963,RBN,"ST HELENS AND KNOWSLEY TEACHING HOSPITALS NHS TRUST",100,80215,0.1
I01963,RWJ,"STOCKPORT NHS FOUNDATION TRUST",0,57170,0.0
I01963,RTP,"SURREY AND SUSSEX HEALTHCARE NHS TRUST",240,53500,0.4
I01963,RMP,"TAMESIDE AND GLOSSOP INTEGRATED CARE NHS FOUNDATION TRUST",*,33485,*
I01963,RBA,"TAUNTON AND SOMERSET NHS FOUNDATION TRUST",45,58740,0.1
I01963,RNA,"THE DUDLEY GROUP NHS FOUNDATION TRUST",45,61625,0.1
I01963,RAS,"THE HILLINGDON HOSPITALS NHS FOUNDATION TRUST",10,40020,0.0
I01963,RTD,"THE NEWCASTLE UPON TYNE HOSPITALS NHS FOUNDATION TRUST",100,102560,0.1
I01963,RQW,"THE PRINCESS ALEXANDRA HOSPITAL NHS TRUST",55,54740,0.1
I01963,RCX,"THE QUEEN ELIZABETH HOSPITAL, KING'S LYNN, NHS FOUNDATION TRUST",0,48690,0.0
I01963,RFR,"THE ROTHERHAM NHS FOUNDATION TRUST",570,36725,1.6
I01963,RDZ,"THE ROYAL BOURNEMOUTH AND CHRISTCHURCH HOSPITALS NHS FOUNDATION TRUST",25,50170,0.0
I01963,RL4,"THE ROYAL WOLVERHAMPTON NHS TRUST",0,69535,0.0
I01963,RA9,"TORBAY AND SOUTH DEVON NHS FOUNDATION TRUST",4540,46315,9.8
I01963,RWD,"UNITED LINCOLNSHIRE HOSPITALS NHS TRUST",60,79920,0.1
I01963,RRV,"UNIVERSITY COLLEGE LONDON HOSPITALS NHS FOUNDATION TRUST",20,70355,0.0
I01963,RHM,"UNIVERSITY HOSPITAL SOUTHAMPTON NHS FOUNDATION TRUST",120,96760,0.1
I01963,RRK,"UNIVERSITY HOSPITALS BIRMINGHAM NHS FOUNDATION TRUST",85,274835,0.0
I01963,RA7,"UNIVERSITY HOSPITALS BRISTOL NHS FOUNDATION TRUST",60,83035,0.1
I01963,RKB,"UNIVERSITY HOSPITALS COVENTRY AND WARWICKSHIRE NHS TRUST",10,98935,0.0
I01963,RTG,"UNIVERSITY HOSPITALS OF DERBY AND BURTON NHS FOUNDATION TRUST",1650,130825,1.3
I01963,RWE,"UNIVERSITY HOSPITALS OF LEICESTER NHS TRUST",45,157045,0.0
I01963,RTX,"UNIVERSITY HOSPITALS OF MORECAMBE BAY NHS FOUNDATION TRUST",215,52110,0.4
I01963,RJE,"UNIVERSITY HOSPITALS OF NORTH MIDLANDS NHS TRUST",155,145845,0.1
I01963,RK9,"UNIVERSITY HOSPITALS PLYMOUTH NHS TRUST",55,72370,0.1
I01963,RBK,"WALSALL HEALTHCARE NHS TRUST",15,45410,0.0
I01963,RWW,"WARRINGTON AND HALTON HOSPITALS NHS FOUNDATION TRUST",130,44615,0.3
I01963,RWG,"WEST HERTFORDSHIRE HOSPITALS NHS TRUST",30,61080,0.0
I01963,RGR,"WEST SUFFOLK NHS FOUNDATION TRUST",315,37150,0.8
I01963,RYR,"WESTERN SUSSEX HOSPITALS NHS FOUNDATION TRUST",10,79290,0.0
I01963,RA3,"WESTON AREA HEALTH NHS TRUST",35,16785,0.2
I01963,RKE,"WHITTINGTON HEALTH NHS TRUST",110,26060,0.4
I01963,RBL,"WIRRAL UNIVERSITY TEACHING HOSPITAL NHS FOUNDATION TRUST",175,65300,0.3
I01963,RWP,"WORCESTERSHIRE ACUTE HOSPITALS NHS TRUST",125,73490,0.2
I01963,RRF,"WRIGHTINGTON, WIGAN AND LEIGH NHS FOUNDATION TRUST",10,47295,0.0
I01963,RLQ,"WYE VALLEY NHS TRUST",35,29750,0.1
I01963,RA4,"YEOVIL DISTRICT HOSPITAL NHS FOUNDATION TRUST",*,29380,*
I01963,RCB,"YORK TEACHING HOSPITAL NHS FOUNDATION TRUST",15,89680,0.0
