INDICATOR_CODE,PROVIDER_CODE,PROVIDER_NAME,DENOMINATOR,IN_HOSPITAL_NUMERATOR,OUT_HOSPITAL_NUMERATOR,IN_HOSPITAL_RATE,OUT_HOSPITAL_RATE
I00733,ENG,"ENGLAND",286524,204618,81906,71.4139,28.5861
I00733,R1F,"ISLE OF WIGHT NHS TRUST",826,548,278,66.3438,33.6562
I00733,R1H,"BARTS HEALTH NHS TRUST",3823,3046,777,79.6756,20.3244
I00733,R1K,"LONDON NORTH WEST HEALTHCARE NHS TRUST",2494,1891,603,75.8220,24.1780
I00733,RA2,"ROYAL SURREY COUNTY HOSPITAL NHS FOUNDATION TRUST",1320,853,467,64.6212,35.3788
I00733,RA3,"WESTON AREA HEALTH NHS TRUST",1026,694,332,67.6413,32.3587
I00733,RA4,"YEOVIL DISTRICT HOSPITAL NHS FOUNDATION TRUST",962,659,303,68.5031,31.4969
I00733,RA7,"UNIVERSITY HOSPITALS BRISTOL NHS FOUNDATION TRUST",1721,1293,428,75.1307,24.8693
I00733,RA9,"TORBAY AND SOUTH DEVON NHS FOUNDATION TRUST",1844,1297,547,70.3362,29.6638
I00733,RAE,"BRADFORD TEACHING HOSPITALS NHS FOUNDATION TRUST",1755,1165,590,66.3818,33.6182
I00733,RAJ,"SOUTHEND UNIVERSITY HOSPITAL NHS FOUNDATION TRUST",2326,1569,757,67.4549,32.5451
I00733,RAL,"ROYAL FREE LONDON NHS FOUNDATION TRUST",2822,1994,828,70.6591,29.3409
I00733,RAP,"NORTH MIDDLESEX UNIVERSITY HOSPITAL NHS TRUST",1400,1123,277,80.2143,19.7857
I00733,RAS,"THE HILLINGDON HOSPITALS NHS FOUNDATION TRUST",991,791,200,79.8184,20.1816
I00733,RAX,"KINGSTON HOSPITAL NHS FOUNDATION TRUST",1261,904,357,71.6891,28.3109
I00733,RBA,"TAUNTON AND SOMERSET NHS FOUNDATION TRUST",1675,1135,540,67.7612,32.2388
I00733,RBD,"DORSET COUNTY HOSPITAL NHS FOUNDATION TRUST",1158,752,406,64.9396,35.0604
I00733,RBK,"WALSALL HEALTHCARE NHS TRUST",1572,1086,486,69.0840,30.9160
I00733,RBL,"WIRRAL UNIVERSITY TEACHING HOSPITAL NHS FOUNDATION TRUST",2272,1648,624,72.5352,27.4648
I00733,RBN,"ST HELENS AND KNOWSLEY HOSPITAL SERVICES NHS TRUST",2226,1539,687,69.1375,30.8625
I00733,RBT,"MID CHESHIRE HOSPITALS NHS FOUNDATION TRUST",1444,954,490,66.0665,33.9335
I00733,RBZ,"NORTHERN DEVON HEALTHCARE NHS TRUST",1244,927,317,74.5177,25.4823
I00733,RC1,"BEDFORD HOSPITAL NHS TRUST",1169,821,348,70.2310,29.7690
I00733,RC9,"LUTON AND DUNSTABLE UNIVERSITY HOSPITAL NHS FOUNDATION TRUST",1693,1202,491,70.9982,29.0018
I00733,RCB,"YORK TEACHING HOSPITAL NHS FOUNDATION TRUST",3185,2169,1016,68.1005,31.8995
I00733,RCD,"HARROGATE AND DISTRICT NHS FOUNDATION TRUST",921,635,286,68.9468,31.0532
I00733,RCF,"AIREDALE NHS FOUNDATION TRUST",990,680,310,68.6869,31.3131
I00733,RCX,"THE QUEEN ELIZABETH HOSPITAL, KING'S LYNN, NHS FOUNDATION TRUST",1510,1034,476,68.4768,31.5232
I00733,RD1,"ROYAL UNITED HOSPITALS BATH NHS FOUNDATION TRUST",1983,1438,545,72.5164,27.4836
I00733,RD3,"POOLE HOSPITAL NHS FOUNDATION TRUST",1565,1198,367,76.5495,23.4505
I00733,RD8,"MILTON KEYNES UNIVERSITY HOSPITAL NHS FOUNDATION TRUST",1238,862,376,69.6284,30.3716
I00733,RDD,"BASILDON AND THURROCK UNIVERSITY HOSPITALS NHS FOUNDATION TRUST",2050,1556,494,75.9024,24.0976
I00733,RDE,"COLCHESTER HOSPITAL UNIVERSITY NHS FOUNDATION TRUST",2205,1539,666,69.7959,30.2041
I00733,RDU,"FRIMLEY HEALTH NHS FOUNDATION TRUST",3465,2534,931,73.1313,26.8687
I00733,RDZ,"THE ROYAL BOURNEMOUTH AND CHRISTCHURCH HOSPITALS NHS FOUNDATION TRUST",2075,1642,433,79.1325,20.8675
I00733,RE9,"SOUTH TYNESIDE NHS FOUNDATION TRUST",1168,886,282,75.8562,24.1438
I00733,REF,"ROYAL CORNWALL HOSPITALS NHS TRUST",2431,1668,763,68.6137,31.3863
I00733,REM,"AINTREE UNIVERSITY HOSPITAL NHS FOUNDATION TRUST",1979,1381,598,69.7827,30.2173
I00733,RF4,"BARKING, HAVERING AND REDBRIDGE UNIVERSITY HOSPITALS NHS TRUST",3140,2324,816,74.0127,25.9873
I00733,RFF,"BARNSLEY HOSPITAL NHS FOUNDATION TRUST",1437,1017,420,70.7724,29.2276
I00733,RFR,"THE ROTHERHAM NHS FOUNDATION TRUST",1484,1039,445,70.0135,29.9865
I00733,RFS,"CHESTERFIELD ROYAL HOSPITAL NHS FOUNDATION TRUST",1793,1246,547,69.4925,30.5075
I00733,RGN,"PETERBOROUGH AND STAMFORD HOSPITALS NHS FOUNDATION TRUST",1896,1286,610,67.8270,32.1730
I00733,RGP,"JAMES PAGET UNIVERSITY HOSPITALS NHS FOUNDATION TRUST",1430,1038,392,72.5874,27.4126
I00733,RGQ,"IPSWICH HOSPITAL NHS TRUST",1975,1356,619,68.6582,31.3418
I00733,RGR,"WEST SUFFOLK NHS FOUNDATION TRUST",1361,945,416,69.4342,30.5658
I00733,RGT,"CAMBRIDGE UNIVERSITY HOSPITALS NHS FOUNDATION TRUST",2276,1528,748,67.1353,32.8647
I00733,RH8,"ROYAL DEVON AND EXETER NHS FOUNDATION TRUST",1918,1383,535,72.1064,27.8936
I00733,RHM,"UNIVERSITY HOSPITAL SOUTHAMPTON NHS FOUNDATION TRUST",2720,2131,589,78.3456,21.6544
I00733,RHQ,"SHEFFIELD TEACHING HOSPITALS NHS FOUNDATION TRUST",3539,2647,892,74.7951,25.2049
I00733,RHU,"PORTSMOUTH HOSPITALS NHS TRUST",3053,2161,892,70.7828,29.2172
I00733,RHW,"ROYAL BERKSHIRE NHS FOUNDATION TRUST",2022,1374,648,67.9525,32.0475
I00733,RJ1,"GUY'S AND ST THOMAS' NHS FOUNDATION TRUST",1471,1067,404,72.5357,27.4643
I00733,RJ2,"LEWISHAM AND GREENWICH NHS TRUST",2398,1817,581,75.7715,24.2285
I00733,RJ6,"CROYDON HEALTH SERVICES NHS TRUST",1292,986,306,76.3158,23.6842
I00733,RJ7,"ST GEORGE'S UNIVERSITY HOSPITALS NHS FOUNDATION TRUST",2109,1603,506,76.0076,23.9924
I00733,RJC,"SOUTH WARWICKSHIRE NHS FOUNDATION TRUST",1145,817,328,71.3537,28.6463
I00733,RJE,"UNIVERSITY HOSPITALS OF NORTH MIDLANDS NHS TRUST",4378,3036,1342,69.3467,30.6533
I00733,RJF,"BURTON HOSPITALS NHS FOUNDATION TRUST",1408,1021,387,72.5142,27.4858
I00733,RJL,"NORTHERN LINCOLNSHIRE AND GOOLE NHS FOUNDATION TRUST",2320,1606,714,69.2241,30.7759
I00733,RJN,"EAST CHESHIRE NHS TRUST",913,639,274,69.9890,30.0110
I00733,RJR,"COUNTESS OF CHESTER HOSPITAL NHS FOUNDATION TRUST",1484,1071,413,72.1698,27.8302
I00733,RJZ,"KING'S COLLEGE HOSPITAL NHS FOUNDATION TRUST",2970,2192,778,73.8047,26.1953
I00733,RK5,"SHERWOOD FOREST HOSPITALS NHS FOUNDATION TRUST",1936,1413,523,72.9855,27.0145
I00733,RK9,"PLYMOUTH HOSPITALS NHS TRUST",2408,1639,769,68.0648,31.9352
I00733,RKB,"UNIVERSITY HOSPITALS COVENTRY AND WARWICKSHIRE NHS TRUST",2844,2017,827,70.9212,29.0788
I00733,RKE,"THE WHITTINGTON HOSPITAL NHS TRUST",524,364,160,69.4656,30.5344
I00733,RL4,"THE ROYAL WOLVERHAMPTON NHS TRUST",2520,1906,614,75.6349,24.3651
I00733,RLN,"CITY HOSPITALS SUNDERLAND NHS FOUNDATION TRUST",2050,1546,504,75.4146,24.5854
I00733,RLQ,"WYE VALLEY NHS TRUST",1136,796,340,70.0704,29.9296
I00733,RLT,"GEORGE ELIOT HOSPITAL NHS TRUST",1067,752,315,70.4780,29.5220
I00733,RM1,"NORFOLK AND NORWICH UNIVERSITY HOSPITALS NHS FOUNDATION TRUST",3429,2413,1016,70.3704,29.6296
I00733,RM2,"UNIVERSITY HOSPITAL OF SOUTH MANCHESTER NHS FOUNDATION TRUST",1905,1421,484,74.5932,25.4068
I00733,RM3,"SALFORD ROYAL NHS FOUNDATION TRUST",1729,1286,443,74.3783,25.6217
I00733,RMC,"BOLTON NHS FOUNDATION TRUST",1764,1259,505,71.3719,28.6281
I00733,RMP,"TAMESIDE HOSPITAL NHS FOUNDATION TRUST",1418,956,462,67.4189,32.5811
I00733,RN3,"GREAT WESTERN HOSPITALS NHS FOUNDATION TRUST",1780,1251,529,70.2809,29.7191
I00733,RN5,"HAMPSHIRE HOSPITALS NHS FOUNDATION TRUST",1991,1501,490,75.3893,24.6107
I00733,RN7,"DARTFORD AND GRAVESHAM NHS TRUST",1545,1073,472,69.4498,30.5502
I00733,RNA,"THE DUDLEY GROUP NHS FOUNDATION TRUST",2359,1763,596,74.7351,25.2649
I00733,RNL,"NORTH CUMBRIA UNIVERSITY HOSPITALS NHS TRUST",1812,1234,578,68.1015,31.8985
I00733,RNQ,"KETTERING GENERAL HOSPITAL NHS FOUNDATION TRUST",1587,1096,491,69.0611,30.9389
I00733,RNS,"NORTHAMPTON GENERAL HOSPITAL NHS TRUST",1808,1336,472,73.8938,26.1062
I00733,RNZ,"SALISBURY NHS FOUNDATION TRUST",1143,856,287,74.8906,25.1094
I00733,RP5,"DONCASTER AND BASSETLAW HOSPITALS NHS FOUNDATION TRUST",2693,1875,818,69.6250,30.3750
I00733,RPA,"MEDWAY NHS FOUNDATION TRUST",1935,1414,521,73.0749,26.9251
I00733,RQ6,"ROYAL LIVERPOOL AND BROADGREEN UNIVERSITY HOSPITALS NHS TRUST",1979,1482,497,74.8863,25.1137
I00733,RQ8,"MID ESSEX HOSPITAL SERVICES NHS TRUST",1926,1348,578,69.9896,30.0104
I00733,RQM,"CHELSEA AND WESTMINSTER HOSPITAL NHS FOUNDATION TRUST",1498,1163,335,77.6368,22.3632
I00733,RQQ,"HINCHINGBROOKE HEALTH CARE NHS TRUST",833,559,274,67.1068,32.8932
I00733,RQW,"THE PRINCESS ALEXANDRA HOSPITAL NHS TRUST",1539,940,599,61.0786,38.9214
I00733,RQX,"HOMERTON UNIVERSITY HOSPITAL NHS FOUNDATION TRUST",595,450,145,75.6303,24.3697
I00733,RR1,"HEART OF ENGLAND NHS FOUNDATION TRUST",4456,3205,1251,71.9255,28.0745
I00733,RR7,"GATESHEAD HEALTH NHS FOUNDATION TRUST",1450,1035,415,71.3793,28.6207
I00733,RR8,"LEEDS TEACHING HOSPITALS NHS TRUST",4123,2925,1198,70.9435,29.0565
I00733,RRF,"WRIGHTINGTON, WIGAN AND LEIGH NHS FOUNDATION TRUST",1682,1131,551,67.2414,32.7586
I00733,RRK,"UNIVERSITY HOSPITALS BIRMINGHAM NHS FOUNDATION TRUST",2715,2003,712,73.7753,26.2247
I00733,RRV,"UNIVERSITY COLLEGE LONDON HOSPITALS NHS FOUNDATION TRUST",1142,847,295,74.1681,25.8319
I00733,RTD,"THE NEWCASTLE UPON TYNE HOSPITALS NHS FOUNDATION TRUST",2767,2051,716,74.1236,25.8764
I00733,RTE,"GLOUCESTERSHIRE HOSPITALS NHS FOUNDATION TRUST",2902,1939,963,66.8160,33.1840
I00733,RTF,"NORTHUMBRIA HEALTHCARE NHS FOUNDATION TRUST",3075,2395,680,77.8862,22.1138
I00733,RTG,"DERBY TEACHING HOSPITALS NHS FOUNDATION TRUST",3185,2345,840,73.6264,26.3736
I00733,RTH,"OXFORD UNIVERSITY HOSPITALS NHS FOUNDATION TRUST",3118,2312,806,74.1501,25.8499
I00733,RTK,"ASHFORD AND ST PETER'S HOSPITALS NHS FOUNDATION TRUST",1639,1158,481,70.6528,29.3472
I00733,RTP,"SURREY AND SUSSEX HEALTHCARE NHS TRUST",1779,1304,475,73.2996,26.7004
I00733,RTR,"SOUTH TEES HOSPITALS NHS FOUNDATION TRUST",2800,2074,726,74.0714,25.9286
I00733,RTX,"UNIVERSITY HOSPITALS OF MORECAMBE BAY NHS FOUNDATION TRUST",1850,1224,626,66.1622,33.8378
I00733,RVJ,"NORTH BRISTOL NHS TRUST",1901,1414,487,74.3819,25.6181
I00733,RVR,"EPSOM AND ST HELIER UNIVERSITY HOSPITALS NHS TRUST",1963,1432,531,72.9496,27.0504
I00733,RVV,"EAST KENT HOSPITALS UNIVERSITY NHS FOUNDATION TRUST",4053,2654,1399,65.4824,34.5176
I00733,RVW,"NORTH TEES AND HARTLEPOOL NHS FOUNDATION TRUST",2046,1479,567,72.2874,27.7126
I00733,RVY,"SOUTHPORT AND ORMSKIRK HOSPITAL NHS TRUST",1249,788,461,63.0905,36.9095
I00733,RW3,"CENTRAL MANCHESTER UNIVERSITY HOSPITALS NHS FOUNDATION TRUST",1708,1358,350,79.5082,20.4918
I00733,RW6,"PENNINE ACUTE HOSPITALS NHS TRUST",4011,2726,1285,67.9631,32.0369
I00733,RWA,"HULL AND EAST YORKSHIRE HOSPITALS NHS TRUST",3489,2400,1089,68.7876,31.2124
I00733,RWD,"UNITED LINCOLNSHIRE HOSPITALS NHS TRUST",3591,2436,1155,67.8363,32.1637
I00733,RWE,"UNIVERSITY HOSPITALS OF LEICESTER NHS TRUST",4494,2951,1543,65.6653,34.3347
I00733,RWF,"MAIDSTONE AND TUNBRIDGE WELLS NHS TRUST",2249,1525,724,67.8079,32.1921
I00733,RWG,"WEST HERTFORDSHIRE HOSPITALS NHS TRUST",2012,1365,647,67.8429,32.1571
I00733,RWH,"EAST AND NORTH HERTFORDSHIRE NHS TRUST",2368,1642,726,69.3412,30.6588
I00733,RWJ,"STOCKPORT NHS FOUNDATION TRUST",1927,1493,434,77.4779,22.5221
I00733,RWP,"WORCESTERSHIRE ACUTE HOSPITALS NHS TRUST",2855,1866,989,65.3590,34.6410
I00733,RWW,"WARRINGTON AND HALTON HOSPITALS NHS FOUNDATION TRUST",1519,1078,441,70.9677,29.0323
I00733,RWY,"CALDERDALE AND HUDDERSFIELD NHS FOUNDATION TRUST",2375,1653,722,69.6000,30.4000
I00733,RX1,"NOTTINGHAM UNIVERSITY HOSPITALS NHS TRUST",4554,3555,999,78.0632,21.9368
I00733,RXC,"EAST SUSSEX HEALTHCARE NHS TRUST",2631,1841,790,69.9734,30.0266
I00733,RXF,"MID YORKSHIRE HOSPITALS NHS TRUST",2935,2101,834,71.5843,28.4157
I00733,RXH,"BRIGHTON AND SUSSEX UNIVERSITY HOSPITALS NHS TRUST",2359,1658,701,70.2840,29.7160
I00733,RXK,"SANDWELL AND WEST BIRMINGHAM HOSPITALS NHS TRUST",2185,1576,609,72.1281,27.8719
I00733,RXL,"BLACKPOOL TEACHING HOSPITALS NHS FOUNDATION TRUST",2380,1709,671,71.8067,28.1933
I00733,RXN,"LANCASHIRE TEACHING HOSPITALS NHS FOUNDATION TRUST",2223,1682,541,75.6635,24.3365
I00733,RXP,"COUNTY DURHAM AND DARLINGTON NHS FOUNDATION TRUST",3025,2108,917,69.6860,30.3140
I00733,RXQ,"BUCKINGHAMSHIRE HEALTHCARE NHS TRUST",1590,1165,425,73.2704,26.7296
I00733,RXR,"EAST LANCASHIRE HOSPITALS NHS TRUST",2626,1902,724,72.4296,27.5704
I00733,RXW,"SHREWSBURY AND TELFORD HOSPITAL NHS TRUST",2621,1723,898,65.7383,34.2617
I00733,RYJ,"IMPERIAL COLLEGE HEALTHCARE NHS TRUST",2318,1727,591,74.5039,25.4961
I00733,RYR,"WESTERN SUSSEX HOSPITALS NHS FOUNDATION TRUST",3110,2111,999,67.8778,32.1222
